OPINIAO;EMPRESA;SERVIÇO;POSSIBLY_SENSITIVE_IS_CORRECT;LOCAL_CIDADE;LOCAL_ESTADO;LOCAL_PAÍS;SEXO_USUÁRIO;id_str;possibly_sensitive;created_at;source;retweet_count;favorite_count;tweet;user_description;user_screen_name;user_followers_count;user_name;user_location;place_country_code;place_country;place_full_name;place_place_type;place_name
Negativo;Vivo;Telefonia e internet;;Vila Velha;Espírito Santo;Brasil;Feminino;3,98E+17;;Thu Nov 07 01:23:46 +0000 2013;"<a href=""http://twitter.com/download/iphone"" rel=""nofollow"">Twitter for iPhone</a>";0;0;@Vivoemrede @vivoon @vivoblog @vivo amanhã mesmo vou portabilidade para Tim adeus vivo enganarão pura,agem como se estivessem fazendo favor;Uma pessoa, gente boa e feliz! Sigam-me os bons!.;danimattedi;157;Daniela R. Mattedi;Vila Velha;;;;;
Negativo;Vivo;Telefonia e internet;;Vila Velha;Espírito Santo;Brasil;Feminino;3,98E+17;;Thu Nov 07 01:25:12 +0000 2013;"<a href=""http://twitter.com/download/iphone"" rel=""nofollow"">Twitter for iPhone</a>";0;0;@Vivoemrede @vivoon @vivoblog @vivo favor para os clientes! Uma porcaria atendentes sem preparação para o público,rede ruim no ES ligações;Uma pessoa, gente boa e feliz! Sigam-me os bons!.;danimattedi;157;Daniela R. Mattedi;Vila Velha;;;;;
Negativo;Vivo;Telefonia e internet;;Vila Velha;Espírito Santo;Brasil;Feminino;3,98E+17;;Thu Nov 07 01:26:12 +0000 2013;"<a href=""http://twitter.com/download/iphone"" rel=""nofollow"">Twitter for iPhone</a>";0;0;@Vivoemrede @vivoon @vivoblog @vivo caem tempo todo!! Horrível!! CHEGA DE VIVO vamos apostar na Tim se for outra merda como a claro, mudo de;Uma pessoa, gente boa e feliz! Sigam-me os bons!.;danimattedi;157;Daniela R. Mattedi;Vila Velha;;;;;
Negativo;Vivo;Telefonia e internet;;Vila Velha;Espírito Santo;Brasil;Feminino;3,98E+17;;Thu Nov 07 01:26:50 +0000 2013;"<a href=""http://twitter.com/download/iphone"" rel=""nofollow"">Twitter for iPhone</a>";0;0;@Vivoemrede @vivoon @vivoblog @vivo de operadora denovo chega de vivo!!!!!! BOSTA DE VIVO!!!;Uma pessoa, gente boa e feliz! Sigam-me os bons!.;danimattedi;157;Daniela R. Mattedi;Vila Velha;;;;;
Negativo;Vivo;Telefonia e internet;;Vila Velha;Espírito Santo;Brasil;Feminino;3,98E+17;;Thu Nov 07 01:31:28 +0000 2013;"<a href=""http://twitter.com/download/iphone"" rel=""nofollow"">Twitter for iPhone</a>";0;0;@Vivoemrede @vivoon @vivoblog @vivo minha conta era 130$ disseram q baixariam sem perder vantagens para 92$ minha conta ta aqui 145$ kd???;Uma pessoa, gente boa e feliz! Sigam-me os bons!.;danimattedi;157;Daniela R. Mattedi;Vila Velha;;;;;
Negativo;Vivo;Telefonia e internet;;Canela;Rio Grande do Sul;Brasil;Masculino;3,98E+17;;Thu Nov 07 16:58:23 +0000 2013;"<a href=""http://itunes.apple.com/us/app/twitter/id409789998?mt=12"" rel=""nofollow"">Twitter for Mac</a>";0;0;Foi muito legal quase virar cliente da @Vivoemrede durante os 25 minutos que esperei pra ser atendido na loja até desistir;um sonho que se sonha so e so um sonho q se sonha so mas sonho que se sonha so é so um sonho q se sonha junto e é um sonho que se realidade sonha só é sonho rea;mirandanilo;14872;Danilo Miranda;Canela - RS;;;;;
Negativo;Vivo;Telefonia e internet;;Belo Horizonte;Minas Gerais;Brasil;Masculino;3,99E+17;;Thu Nov 07 19:36:41 +0000 2013;web;0;0;Porra #vivoemrede! Só preciso aumentar o meu plano e estou a mais de 1h e 30m, 4 ligações para não ter nenhum atendimento #servicodemerda;Service Designer Co-Founder at DesignThinkers Brasil, Voël Design and Mozaiko.;geovanerodrigue;664;Geovane Rodrigues;Belo Horizonte;;;;;
Negativo;Vivo;Telefonia e internet;;São Paulo;São Paulo;Brasil;Masculino;3,99E+17;;Fri Nov 08 01:06:00 +0000 2013;web;0;0;Agradeço, comovido, a @vivoemrede por me deixar de novo sem internet. E agora, com um requinte: sem televisão também. Isso é aperfeiçoamento;Paulistano do Bom Retiro, canhoto, bibliômano, fanático por pizza e massa, colunista do jornal O Estado de S. Paulo e comentarista dos canais ESPN.;anterogreco;98935;Antero Greco;;;;;;
Negativo;Vivo;Telefonia e internet;;Porto Alegre;Rio Grande do Sul;Brasil;Masculino;3,99E+17;;Fri Nov 08 13:34:01 +0000 2013;"<a href=""http://www.echofon.com/"" rel=""nofollow"">Echofon</a>";0;0;Algum policial aí poderia me dar voz de prisão? Assim, vou pra cadeia e conseguirei usar meu @vivoemrede!!!!;"Repórter sem rosto. RBSTV/ TV Globo.
Contato: giovani.grizotti@rbstv.com.br";giovanigrizotti;36596;Giovani Grizotti;Porto Alegre/ Brasil;;;;;
Negativo;Vivo;Telefonia e internet;;Porto Alegre;Rio Grande do Sul;Brasil;Masculino;3,99E+17;;Fri Nov 08 13:46:47 +0000 2013;"<a href=""http://www.echofon.com/"" rel=""nofollow"">Echofon</a>";0;0;Na minha casa, não pega @vivoemrede. Mas nas galerias A, B, C, D e E do Presídio Central, o sinal bomba!;"Repórter sem rosto. RBSTV/ TV Globo.
Contato: giovani.grizotti@rbstv.com.br";giovanigrizotti;36596;Giovani Grizotti;Porto Alegre/ Brasil;;;;;
Negativo;Vivo;Telefonia e internet;;Sorocaba;São Paulo;Brasil;Feminino;3,99E+17;;Fri Nov 08 15:14:01 +0000 2013;web;0;0;#Speedy #Vivo LIXO DE SERVIÇO, o de vocês hein.;I talk shit just deal with it. ?;Julhynha;372;Juliana Lopes;Sorocaba-SP;;;;;
Negativo;Vivo;Telefonia e internet;;;Bahia;Brasil;Feminino;3,99E+17;;Sat Nov 09 02:19:17 +0000 2013;web;0;0;@Vivoemrede @NaldoValenca  esse #VivoEmrede deve ser robô. repete a mesma coisa p todos os clientes e naõ resolve nada via DM. SAC OFF full;"Ex-sindicalista.Estudei Direito/ Administração. Quando não defendemos nossos direitos perdemos a dignidade e esta não
se negocia! https://t.co/zYSEbwvi";mluvieira;4557;MluizaVieira;Bahia-Brasil;;;;;
Negativo;Vivo;Telefonia e internet;;Camaquã;Rio Grande do Sul;Brasil;Masculino;3,99E+17;;Sat Nov 09 16:09:25 +0000 2013;"<a href=""http://twitter.com/download/iphone"" rel=""nofollow"">Twitter for iPhone</a>";0;0;"Com apenas 3 meses de @Vivoemrede, estou voltando pra OI. Sério, Vivo é uma baita enganação. Principalmente o ""limite 3G"".";tanto odio, tanto amor y tantas cosas -  Shows: mechamoesteban@gmail.com / esteban@olelemusic.com.br;estebantavares;232667;Esteban Tavares;Camaquã/RS;;;;;
Negativo;Vivo;Telefonia e internet;;Camaquã;Rio Grande do Sul;Brasil;Masculino;3,99E+17;;Sat Nov 09 16:10:41 +0000 2013;"<a href=""http://twitter.com/download/iphone"" rel=""nofollow"">Twitter for iPhone</a>";0;0;“@aninhaxx: @estebantavares @Vivoemrede ata, dai tu vai mudar de CU pra CU PRETO?” Fui da OI 4 anos e NUNCA tive problema.;tanto odio, tanto amor y tantas cosas -  Shows: mechamoesteban@gmail.com / esteban@olelemusic.com.br;estebantavares;232667;Esteban Tavares;Camaquã/RS;;;;;
Negativo;Vivo;Telefonia e internet;;São Paulo;São Paulo;Brasil;Masculino;3,99E+17;;Sat Nov 09 22:43:56 +0000 2013;web;0;0;@Vivoemrede @vivoblog #Vivoemrede #vivoblog  vivo ou telefonica é pior aqui pereferia de SP Capital lixo puro não tem qualidade Net lixxxx00;http://www.habbo.com.br/room/12658939;traxshow;270;Leonardo Schott ;habbo;;;;;
Negativo;Vivo;Telefonia e internet;;;São Paulo;Brasil;Masculino;4,00E+17;;Sun Nov 10 22:53:18 +0000 2013;"<a href=""http://tapbots.com/tweetbot"" rel=""nofollow"">Tweetbot for iOS</a>";0;0;Só para constar, a @Vivoemrede é a pior operadora do universo! Atendimento ridículo! Estou a 55 minutos esperando o atendente!;Head of Product Design da Movile, sócio @FTips, Co-Founder ONoffRE e MonsterJuice, palestrante, colaborador do MacMagazine, Apple Evangelist. Resumindo: Geek!;macmasi;24168;Breno Masi ?;São Paulo;;;;;
Negativo;Vivo;Telefonia e internet;;;São Paulo;Brasil;Masculino;4,00E+17;;Mon Nov 11 01:55:30 +0000 2013;"<a href=""http://tapbots.com/tweetbot"" rel=""nofollow"">Tweetbot for iOS</a>";0;0;Por incrível que pareça ainda estou tentando falar com a @Vivoemrede. Acho que pouco importa para eles mas amanhã mudo para @ClaroRonaldo;Head of Product Design da Movile, sócio @FTips, Co-Founder ONoffRE e MonsterJuice, palestrante, colaborador do MacMagazine, Apple Evangelist. Resumindo: Geek!;macmasi;24167;Breno Masi ?;São Paulo;;;;;
Negativo;Vivo;Telefonia e internet;;Brasília;Distrito Federal;Brasil;Masculino;4,00E+17;;Mon Nov 11 08:41:49 +0000 2013;"<a href=""http://twitter.com/download/android"" rel=""nofollow"">Twitter for Android</a>";0;0;@vivo vai conseguir me tirar do sério.  Nao há santo que consiga falar no telemarketing dessa empresa lixo;Flávio Bueno - Acima de tudo rubro-negro!!!! Professor, Publicitáriio, tocador, Salgueirense, RLD!!!;flaviobueno13;897;Flávio Bueno;Brasília - DF;;;;;
Negativo;Vivo;Telefonia e internet;;;Rio de Janeiro;Brasil;Masculino;4,00E+17;;Mon Nov 11 19:03:50 +0000 2013;"<a href=""http://twitter.com/download/android"" rel=""nofollow"">Twitter for Android</a>";0;0;"Enquete. Qual a pior concessionária? 
@SuperVia_trens
@metro_rio
@novacedae
@lightclientes
@TIM_AJUDA
@ClaroRonaldo
@Vivoemrede 
@oi";Engenheiro e Advogado. Vascaíno de Coração.  Divorciado. Apaixonado pelo amor da minha vida, minha filha Clarissa.;Gustavo39673075;62;Gustavo Corrêa;Rio de Janeiro;;;;;
Negativo;Vivo;Telefonia e internet;;Porto Alegre;Rio Grande do Sul;Brasil;Masculino;4,01E+17;;Wed Nov 13 09:12:53 +0000 2013;"<a href=""http://twitter.com/download/android"" rel=""nofollow"">Twitter for Android</a>";0;0;A picaretagem da @vivo é tamanha que até o *8486 cai durante a ligação. As teles assinam TAC más não cumprem né @MP-RS @ProconRS;Economia , política e Vigoroso combate a mídia golpista e comercial.;gilmardarosa;1280;Gilmar da Rosa;Porto Alegre;BR;Brasil;Sapiranga, Rio Grande do Sul;city;Sapiranga
Negativo;Vivo;Telefonia e internet;;;;Brasil;Feminino;4,01E+17;;Wed Nov 13 11:27:08 +0000 2013;"<a href=""http://twitter.com/download/iphone"" rel=""nofollow"">Twitter for iPhone</a>";0;0;Sempre aguentei os desaforos da @vivo mas agora foi o cúmulo do desaforo #Vivoemrede aguardem meu processo;;natalia_soulthi;21;? Natyzinha? ;Brazilian;;;;;
Negativo;Vivo;Telefonia e internet;;;São Paulo;Brasil;Feminino;4,01E+17;;Wed Nov 13 14:31:47 +0000 2013;web;0;0;#vivoemrede onde esta seu atendimento???;jornalista, cinéfila, curiosíssima e indecifrável...;Erika_Salgaddo;37;Erika Salgado;São Paulo;;;;;
Negativo;Vivo;Telefonia e internet;;;São Paulo;Brasil;Feminino;4,01E+17;;Wed Nov 13 14:34:24 +0000 2013;web;0;0;#vivoemrede chat não funciona, telefone não funciona, sms não funciona, perfil no facebook não funciona, twitter não funciona...;jornalista, cinéfila, curiosíssima e indecifrável...;Erika_Salgaddo;37;Erika Salgado;São Paulo;;;;;
Negativo;Vivo;Telefonia e internet;;São Luíz;Maranhão;Brasil;Feminino;4,01E+17;;Wed Nov 13 18:27:00 +0000 2013;"<a href=""http://twitter.com/download/iphone"" rel=""nofollow"">Twitter for iPhone</a>";0;0;@Vivoemrede E qual foi o problema mesmo com o 3G em São Luís? Há 3 horas sem funcionar! Obg;Raramente fico mal-humorada, facilmente fico triste e mais facilmente ainda mudo de triste para alegre e de alegre para triste .;JessMatos;454;Jazzica;São Luis, MA. Brazil;BR;Brasil;São Luís, Maranhão;city;São Luís
Negativo;Vivo;Telefonia e internet;;;;Brasil;Feminino;4,01E+17;;Thu Nov 14 09:15:04 +0000 2013;"<a href=""http://twitter.com/download/iphone"" rel=""nofollow"">Twitter for iPhone</a>";0;0;E cadastra sua reclamação, então PQ pergunta se pode ajudar fica quieta #Vivoemrede;;natalia_soulthi;22;? Natyzinha? ;Brazilian;;;;;
Negativo;Vivo;Telefonia e internet;;;;;Feminino;4,02E+17;;Sun Nov 17 11:57:10 +0000 2013;"<a href=""http://www.WindowsPhone.com/"" rel=""nofollow"">Windows Phone</a>";0;0;Pra variar, #VIVO sem sinal;Uma filha da pós modernidade que teima em andar na marcha lenta!;veronica_frs;302;veronica_frs;;;;;;
Negativo;Vivo;Telefonia e internet;;Fortaleza;Ceará;Brasil;Masculino;4,02E+17;;Sun Nov 17 12:53:55 +0000 2013;"<a href=""http://twitter.com/download/android"" rel=""nofollow"">Twitter for Android</a>";0;0;O 3G da @Vivo é péssimo. Não recomendo,não entrega sequer 1/5 da velocidade prometida. Vou mudar. #Fail;Jornalista, Professor Universitário e Assessor de Comunicação;cesarespindola4;1779;César Espíndola;Fortaleza-Ce;;;;;
Negativo;Vivo;Telefonia e internet;;;São Paulo;Brasil;Feminino;4,02E+17;;Mon Nov 18 14:13:26 +0000 2013;web;0;0;Como a @vivoemrede pode ser tão confusa, gente? 5a. equipe q vem em casa pra instalar a fibra óptica e nunca acertam dia, linha, etc.;World Wide Woman -  Física/Escriba  ( http://farofa.com.br) // texts - https://medium.com/@rosana/;rosana;435778;rosana hermann ;São Paulo;;;;;
Negativo;Vivo;Telefonia e internet;;;São Paulo;Brasil;Feminino;4,02E+17;;Mon Nov 18 14:37:52 +0000 2013;web;0;0;Há 20 min c/ a moça da @vivoemrede e ela me diz:'tem que aguardar pq eu não tenho fibra optica aqui' pq o prédio é velho no centro de SP.;World Wide Woman -  Física/Escriba  ( http://farofa.com.br) // texts - https://medium.com/@rosana/;rosana;435774;rosana hermann ;São Paulo;;;;;
Negativo;Vivo;Telefonia e internet;;;São Paulo;Brasil;Masculino;4,02E+17;;Mon Nov 18 16:37:36 +0000 2013;web;0;0;ACHO QUE NAO EXISTE PIOR SERVIÇO DE TELEFONIA DO QUE A @Vivoemrede QUE DEIXA A GENTE MORTA DE RAIVA;Narrador esportivo. Qual quer duvida compre o livro OLHO NO LANCE.;silvioluiz;510940;Silvio Luiz;São Paulo, Brasil;;;;;
Negativo;Vivo;Telefonia e internet;;;São Paulo;Brasil;Masculino;4,02E+17;;Mon Nov 18 16:38:35 +0000 2013;web;0;0;@Vivoemrede POR QUE O TELEFONE DA OUVIDORIA NAO ATENDE?;Narrador esportivo. Qual quer duvida compre o livro OLHO NO LANCE.;silvioluiz;510940;Silvio Luiz;São Paulo, Brasil;;;;;
Negativo;Vivo;Telefonia e internet;;;São Paulo;Brasil;Masculino;4,02E+17;;Mon Nov 18 17:00:26 +0000 2013;web;0;0;30 MINUTOS PARA TENTAR RECLAMAR DO PESSIMO SERVIÇO DA @Vivoemrede;Narrador esportivo. Qual quer duvida compre o livro OLHO NO LANCE.;silvioluiz;510940;Silvio Luiz;São Paulo, Brasil;;;;;
Negativo;Vivo;Telefonia e internet;;;São Paulo;Brasil;Masculino;4,02E+17;;Mon Nov 18 17:12:40 +0000 2013;web;0;0;A FRASE QUE A @Vivoemrede  MAIS CONHECE É ANOTE O PROTOCOLO;Narrador esportivo. Qual quer duvida compre o livro OLHO NO LANCE.;silvioluiz;510941;Silvio Luiz;São Paulo, Brasil;;;;;
Negativo;Vivo;Telefonia e Internet;;;;Brasil;Feminino;4,03E+17;;Tue Nov 19 19:40:09 +0000 2013;web;0;0;Muito aborrecida com a empresa @vivo @Vivoemrede. Há dois meses, tentando cancelar um modem. E não consigo. E as contas chegando...;Jornalista, especializada em Comunicação Empresarial. Assessora de comunicação. Interessada em cultura digital, empreendedorismo e pessoas.;clausoares;950;clausoares;Brasil;;;;;
Negativo;Vivo;Telefonia e Internet;;Rio de Janeiro;Rio de Janeiro;Brasil;Masculino;4,03E+17;false;Wed Nov 20 04:28:02 +0000 2013;"<a href=""http://instagram.com"" rel=""nofollow"">Instagram</a>";0;0;Especialmente pro #luansantana e esse marketing fdp da #vivo http://t.co/HcseQzxlAu;Vascaíno, Amendobobo Yeah, Ator, Produtor, Editor do @lafenixvideos, metido a cozinheiro e Pai da Marina *.*;henriqueminimim;19888;HenriqueMinimim Leão;ÜT: -22.797008,-43.207325;;;;;
Negativo;Vivo;Telefonia e Internet;;Fortaleza;Ceará;Brasil;Masculino;4,03E+17;;Wed Nov 20 09:53:46 +0000 2013;"<a href=""http://twitter.com/download/android"" rel=""nofollow"">Twitter for Android</a>";0;0;A @Vivo está fazendo o contrário da decisão da Anatel. Invés de entregar 70% da banda larga, só libera 30%. Alô fiscalização! #Anatel;Jornalista, Professor Universitário e Assessor de Comunicação;cesarespindola4;1780;César Espíndola;Fortaleza-Ce;;;;;
Negativo;Vivo;Telefonia e Internet;;;São Paulo;Brasil;Masculino;4,04E+17;;Fri Nov 22 01:16:15 +0000 2013;web;0;0;BANDO DE INÚTIL! QUE ÓDIO QUE ME DA! @ClaroRonaldo @Vivoemrede SEUS LIXOS! VOCÊS SÃO O RETRATO DO DESCASO AO CONSUMIDOR! MALDITOS;96's kid, founder of a big brand http://instagram.com/leopicon contato: contatopicon@gmail.com;Piconn;183611;Leonardo Picon Froes;São Paulo - Brazil;;;;;
Negativo;Vivo;Telefonia e Internet;;São Paulo;São Paulo;Brasil;Feminino;4,04E+17;;Fri Nov 22 14:20:21 +0000 2013;"<a href=""http://twitter.com/#!/download/ipad"" rel=""nofollow"">Twitter for iPad</a>";0;0;Como é difícil falar com a @vivo por telefone! A ligação já caiu duas sem que eu consiga concluir o atendimento.;;ka_schmidt;525;Karen Schmidt;ÜT: -23.502535,-46.565866;;;;;
Negativo;Vivo;Telefonia e Internet;;;;;Não informado;4,04E+17;;Fri Nov 22 16:00:19 +0000 2013;"<a href=""http://twitter.com/download/android"" rel=""nofollow"">Twitter for Android</a>";0;0;eu vou processar vcs @vivo;? sometimes the story has no end ?;donatellawn;870;helô;? amora ?;;;;;
Negativo;Vivo;Telefonia e Internet;;;;;Não informado;4,04E+17;;Fri Nov 22 18:36:53 +0000 2013;web;0;0;"@Vivoemrede ""vivo em rede"" propaganda enganosa feelings";LOUD TOUR;youngabes;93;gabe ?;• 15 dias •;;;;;
Negativo;Vivo;Telefonia e Internet;;;São Paulo;Brasil;Masculino;4,04E+17;;Fri Nov 22 20:35:05 +0000 2013;web;0;0;"@claudiabistao  Serviço horrivellllll &gt;&gt;&gt;&gt; @Vivoemrede #Vivoemrede";Pai da Julia e do Miguel apaixonado por SP. Assessor Politico no gabinete do Vereador  @AndreaMatarazzo estudante de Ciências Sociais e ante PeTralhas.;Batistafabio;1701;Fabio Batista ;São Paulo - SP;;;;;
Negativo;Vivo;Telefonia e Internet;;;;;Feminino;4,04E+17;;Fri Nov 22 20:38:45 +0000 2013;"<a href=""http://blackberry.com/twitter"" rel=""nofollow"">Twitter for BlackBerry®</a>";0;0;@Batistafabio @Vivoemrede #Vivoemrede Eles querem resolver tudo por SMS! Quase mudando para a TIm!!!!;lutando por um Brasil melhor;claudiabistao;844;Claudia Bistão;;;;;;
Negativo;Vivo;Telefonia e Internet;;Manaus;Amazonas;Brasil;Não informado;4,04E+17;;Sun Nov 24 05:16:43 +0000 2013;web;0;0;@vivo sua desgraçada, devolve a minha internet;"Bem no fundo de um universo
Paralelo # RHCP ? Nirvana ? John Frusciante ? Lana minha chata ?";tata_rhcp;720;Tataa ?;manaus-AM;;;;;
Negativo;Vivo;Telefonia e Internet;;Divinópolis;Minas Gerais;Brasil;Feminino;4,05E+17;;Mon Nov 25 15:06:47 +0000 2013;"<a href=""http://twitter.com/download/iphone"" rel=""nofollow"">Twitter for iPhone</a>";0;0;alo @Vivoemrede da um jeito nessa internet LIXO de vcs pq nao ta dando nao;blessed;danifagundes_;491;daniele;Divinópolis / MG ;;;;;
Negativo;Vivo;Telefonia e Internet;;Porto Alegre;Rio Grande do Sul;Brasil;Masculino;4,05E+17;;Mon Nov 25 23:37:56 +0000 2013;"<a href=""http://twitter.com/download/android"" rel=""nofollow"">Twitter for Android</a>";0;0;To na loja da @vivo no @praiadebelas com 3 demandas e não atendem nenhuma, pq querem fechar a loja 21:37 #MeEnganaVivo;Capitão da BRIGADA MILITAR e isso por si só já fala tudo...;julianopolicia;1572;juliano andre amaral;Porto Alegre, RS;;;;;
Negativo;Vivo;Telefonia e Internet;;Rio de Janeiro;Rio de Janeiro;Brasil;Masculino;4,05E+17;;Tue Nov 26 13:16:38 +0000 2013;"<a href=""http://twitter.com/download/iphone"" rel=""nofollow"">Twitter for iPhone</a>";0;0;O pior é você ir na loja da @Vivoemrede e a mocinha não só duvidar de você como não te ajudar a solucionar o problema.;Contato: carauta@carauta.com.br;bernardofalcone;516399;Beni;;BR;Brasil;Rio de Janeiro, Rio de Janeiro;city;Rio de Janeiro
Negativo;Vivo;Telefonia e Internet;;Manaus;Amazonas;Brasil;Não informado;4,05E+17;;Tue Nov 26 23:21:26 +0000 2013;"<a href=""http://twitter.com/download/android"" rel=""nofollow"">Twitter for Android</a>";0;0;internet @vivo sempre uma merda;"Bem no fundo de um universo
Paralelo # RHCP ? Nirvana ? John Frusciante ? Lana minha chata ?";tata_rhcp;721;Tataa ?;manaus-AM;;;;;
Negativo;Vivo;Telefonia e Internet;;Campos do Jordão ;São Paulo;Brasil;Masculino;4,06E+17;false;Wed Nov 27 01:18:47 +0000 2013;"<a href=""http://twitter.com/tweetbutton"" rel=""nofollow"">Tweet Button</a>";0;0;Chuva desde domingo em Campos do Jordão. E há três dias o Speedy da Vivo está Slow.... #vivoemrede  http://t.co/lTLuJQyNsJ #speedtest;Repórter da Tv Band. Um incansável contador de histórias! Instagram: correianews;MarcioCorreia01;227;Márcio Correia;Campos do Jordão - SP;;;;;
Negativo;Vivo;Telefonia e Internet;;Tamboré;São Paulo;Brasil;Masculino;4,06E+17;;Thu Nov 28 14:16:32 +0000 2013;"<a href=""http://twitter.com/download/iphone"" rel=""nofollow"">Twitter for iPhone</a>";0;0;Se quiser fugir do sol faça um 3G da @vivo nenhuma outra empresa oferece tantas zonas de sombra...;Locutor, jornalista, redator, roteirista, deformador de opinião e filósofo barato.;luizcebola;1449;CEBOLA;Tamboré, SP - BRAZIL;;;;;
Negativo;Vivo;Telefonia e Internet;;Sorocaba;São Paulo;Brasil;Masculino;4,06E+17;;Thu Nov 28 15:10:00 +0000 2013;"<a href=""http://twitter.com/download/android"" rel=""nofollow"">Twitter for Android</a>";0;0;#vivo , internet muito lenta!!;A alegria adquire-se. É uma atitude de coragem. Ser alegre não é fácil, é um ato de vontade , 18 , http://ask.fm/igorfelipe .;IgorFelipe;36680;Igor Felipe;Sorocaba-SP;;;;;
Negativo;Vivo;Telefonia e Internet;;;São Paulo;Brasil;Masculino;4,06E+17;;Fri Nov 29 17:58:45 +0000 2013;web;0;0;Lembra 5 dias atras quando disse q havia solicitado os serviços de telefonia e internet fixa da @Vivoemrede e q ja estava arrependido?;"Diretor d Externas/˜Criação @programapanico                    



CONTATOS COMERCIAIS : bolinha@onesports.com.br  /   http://www.ebpz.com.br";bolinhamarcelo;1008648;Bolinha;são paulo;;;;;
Negativo;Vivo;Telefonia e Internet;;;São Paulo;Brasil;Masculino;4,06E+17;;Fri Nov 29 18:02:07 +0000 2013;web;0;0;"Me foi passado q nem pedido da internet tinha. Ai chegamos no ponto em que eu me irrito e tento cancelar o ""serviço"" ""pretado"" @Vivoemrede";"Diretor d Externas/˜Criação @programapanico                    



CONTATOS COMERCIAIS : bolinha@onesports.com.br  /   http://www.ebpz.com.br";bolinhamarcelo;1008649;Bolinha;são paulo;;;;;
Negativo;Vivo;Telefonia e Internet;;;São Paulo;Brasil;Masculino;4,06E+17;;Fri Nov 29 18:02:50 +0000 2013;web;0;0;30 minutos na espera, passei por 3 atendentes , todas extremamente mal-educadas, com respostinhas prontos e ate engraçadinhas @Vivoemrede;"Diretor d Externas/˜Criação @programapanico                    



CONTATOS COMERCIAIS : bolinha@onesports.com.br  /   http://www.ebpz.com.br";bolinhamarcelo;1008648;Bolinha;são paulo;;;;;
Negativo;Vivo;Telefonia e Internet;;;São Paulo;Brasil;Masculino;4,06E+17;;Fri Nov 29 18:06:45 +0000 2013;web;0;0;quando perguntado sobre o motivo do cancelamento informei tudo isso e q em 3 ligações @Vivoemrede .... nunca tinha sido tão mal atendido...;"Diretor d Externas/˜Criação @programapanico                    



CONTATOS COMERCIAIS : bolinha@onesports.com.br  /   http://www.ebpz.com.br";bolinhamarcelo;1008643;Bolinha;são paulo;;;;;
Negativo;Vivo;Telefonia e Internet;;;São Paulo;Brasil;Masculino;4,06E+17;;Fri Nov 29 18:07:34 +0000 2013;web;0;0;como fui em toda minha vida por empresas q me prestam serviços @Vivoemrede .Como me deixaram 30 minutos na espera do cancelamento,sendo q ..;"Diretor d Externas/˜Criação @programapanico                    



CONTATOS COMERCIAIS : bolinha@onesports.com.br  /   http://www.ebpz.com.br";bolinhamarcelo;1008641;Bolinha;são paulo;;;;;
Negativo;Vivo;Telefonia e Internet;;;São Paulo;Brasil;Masculino;4,06E+17;;Fri Nov 29 18:08:25 +0000 2013;web;0;0;"ja havia falado e me ionformado q o cancelamenbto ja havia sido feito e a ligação ""caiu"" bem na minha cara, informo p  vcs da @Vivoemrede :";"Diretor d Externas/˜Criação @programapanico                    



CONTATOS COMERCIAIS : bolinha@onesports.com.br  /   http://www.ebpz.com.br";bolinhamarcelo;1008639;Bolinha;são paulo;;;;;
Negativo;Vivo;Telefonia e Internet;;;São Paulo;Brasil;Masculino;4,06E+17;;Fri Nov 29 18:09:58 +0000 2013;web;0;0;Nao me venham  cobrar por um serviço de 5 dias que vcs não fizeram e não falem  que nao se completou o cancelamento @Vivoemrede;"Diretor d Externas/˜Criação @programapanico                    



CONTATOS COMERCIAIS : bolinha@onesports.com.br  /   http://www.ebpz.com.br";bolinhamarcelo;1008635;Bolinha;são paulo;;;;;
Negativo;Vivo;Telefonia e Internet;;;São Paulo;Brasil;Masculino;4,06E+17;;Fri Nov 29 18:10:44 +0000 2013;web;0;0;pois foram vcs depois d 30 minutos q desligaram na minha cara @Vivoemrede . Nao pagarei bosta nenhuma p vcs e proximo passo cancelar celular;"Diretor d Externas/˜Criação @programapanico                    



CONTATOS COMERCIAIS : bolinha@onesports.com.br  /   http://www.ebpz.com.br";bolinhamarcelo;1008632;Bolinha;são paulo;;;;;
Negativo;Vivo;Telefonia e Internet;;;São Paulo;Brasil;Masculino;4,06E+17;;Fri Nov 29 18:11:30 +0000 2013;web;0;0;Aprendam a serem no minimo educados com quem é cliente de vcs @Vivoemrede . Empresa lixo, perda d tempo ja aviso todos vcs;"Diretor d Externas/˜Criação @programapanico                    



CONTATOS COMERCIAIS : bolinha@onesports.com.br  /   http://www.ebpz.com.br";bolinhamarcelo;1008631;Bolinha;são paulo;;;;;
Negativo;Vivo;Telefonia e Internet;;;São Paulo;Brasil;Masculino;4,06E+17;;Fri Nov 29 18:13:01 +0000 2013;web;0;0;Obrigado  JANIA  a unica ajuda q quero de vcs é o cancelamento desta merda @Vivoemrede obrigado;"Diretor d Externas/˜Criação @programapanico                    



CONTATOS COMERCIAIS : bolinha@onesports.com.br  /   http://www.ebpz.com.br";bolinhamarcelo;1008631;Bolinha;são paulo;;;;;
Negativo;Vivo;Telefonia e Internet;;;São Paulo;Brasil;Masculino;4,06E+17;;Fri Nov 29 18:37:34 +0000 2013;"<a href=""http://twitter.com/download/iphone"" rel=""nofollow"">Twitter for iPhone</a>";0;0;Prefiro ficar sem internet em casa do q ter a de uma empresa q trata seu cliente como merda e com piadinhas @Vivoemrede;"Diretor d Externas/˜Criação @programapanico                    



CONTATOS COMERCIAIS : bolinha@onesports.com.br  /   http://www.ebpz.com.br";bolinhamarcelo;1008625;Bolinha;são paulo;;;;;
