opiniao;tweet
Negativo;oh my god unhappy  next time mishutuuu
Negativo;Can you say Hi julia ??pleasee crying
Negativo;Bby unhappy  your emotion
Negativo;I seriously thought that Coldplay was going to be band like Depeche Mode or U2, just kept going unhappy
Negativo;poor baby unhappy  I hate people
Negativo;unhappy  i have to be strong today jfjfjkf
Negativo;I NEED A UNICORN FRAPPUCCINO STAT. I JUST FOUND OUT THEY ARE LIMITED TIMEE! unhappy  How much longer?
Negativo;Her back unhappy
Negativo;unhappy  sorry to hear this.....
Negativo;I won't. if i do it's probably for phil but he hasn't seen me yet unhappy
Negativo;Yuri was here and i didn't know it unhappy  the second snsd i missed
Negativo;why are your campervan tickets so expensive? unhappy
Negativo;Canberra is a land-locked capital. unhappy
Negativo;how much? i cant seem to deathmatch you unhappy
Negativo;.agata baby unhappy  it broke in the mail. but i read your letter  can't thank you enough. you are the best
Negativo;same unhappy
Negativo;she is! HAHA but I wanted to look like v unhappy
Negativo;unhappy  they look dead
Negativo;Puta I know sorry isn't enough pero sorry padin unhappy
Negativo;mannn, i want to go to an m's game unhappy
Negativo;unhappy   feeling bored
Negativo;I wish i could sleep early unhappy
Negativo;I just hope I start getting the 1GB data per day from tonight!! unhappy
Negativo;Koalas are dying of thirst  and it's all because of us unhappy
Negativo;i want to see you happy sad
Negativo;I just told them to bugger off and hung up! They waned access to my pc. If they phoned someone like my Gran
Negativo;my braces hurt unhappy
Negativo;Ohh welcome to CLXSSlC chanyeol oppa! Or should I call you with richard? Kalau jadi sayang gimana? unhappy
Negativo;we don%27t talk anymore like we used to do unhappy
Negativo;Claaaaaaaaaaaaasse !
Negativo;What a pity! unhappy  Those were beautiful! But thank you for your answer!
Negativo;Sciatica. What a monumental pain in the arse. unhappy
Negativo;This escalated quickly, I'm aborting mission now have a nice day though x
Negativo;- Thank you tons, rocks. next question - where is my astro unhappy  ?
Negativo;Her back unhappy
Negativo;No stream tonight! Throat is killing me. unhappy
Negativo;Me too...I won't miss the HGVs going past our house though. It was a nice looking building - had initiall
Negativo;Don't say that unhappy
Negativo;Summer's not in our school's vocabulary unhappy  We need air. Please tell
Negativo;Bae's not here unhappy
Negativo;Wanna get a haircut but i don%27t know a good place unhappy
Negativo;it feels kind of empty w/o youngjae at the venue.. unhappy
Negativo;Her back unhappy
Negativo;Yeah , i think that's going to be true , he can't leave us unhappy
Negativo;Yesterday felt like friday unhappy
Negativo; [PLEASE RT] he'll buy me a blinking taehyung headband, if i get 900 retweets and 900 likes. help me :(un
Negativo;yes instant message sad crying
Negativo;I face swapped a cat with a dog and it's really upsetting unhappy
Negativo;Nice! Some really nice stuff there! Mostly black dresses which i won't get away with for a June wedding though unhappy
Negativo;I miss you unhappy
Negativo;Beyond sad unhappy
Negativo;Goodnight princess, I love you  have fun with your friends
Negativo;YG should have sent them to MCD. I want to see them holding the trophy unhappy  anyways
Negativo;Something is really wrong. I should be spending my days naked on a beach in the hot sunshine. Not working in the cold in King's Lynn sad
Negativo;Punishment time for JB's team! unhappy
Negativo;Aw goodnight angel! I love you lots and I hope you're going to have the best tiame and a lot of fun!! Wonho's already am
Negativo;Not really an amount just loads of sections unhappy  I'll ride up to to netherton now meet me at Darby end ?
Negativo;Q2 I'm not an MH healthcare professional. As much as I want to help I'm scared to death I might make the situation
Negativo;Got a msg! Oops not you unhappy
Negativo;Just chillin~ it's a bit quiet tonight on my tough luck unhappy  what about you??
Negativo; I bet The media's one-sided view of Tim Tams surprisingly was the alt-right roar extreme droll Fad unhappy
Negativo;my hair is not as crisp unhappy
Negativo;a couple more unhappy
Negativo;what the fuck don%27t unhappy
Negativo;Going to CA in July, our reunion is in August unhappy
Negativo;The road and traffic signs section of theory revision is such a myth unhappy
Negativo;unhappy  We're sorry your pizza arrived with mushrooms despite your request. Could you please get in touch vi
Negativo;you're a kabute unhappy
Negativo;last to  things i've bought from you no sweets unhappy
Negativo;Wish I could stay in bed all day and listen to the rain sad
Negativo;I don't want to tell fellow Comm students because i don't want them to think I'm some kind of suck-up... unhappy
Negativo;When will you notice me? unhappy
Negativo;GO AWAY unhappy
Negativo;ally unhappy  I can't make a poem about being cute
Negativo;ehh i cant DM you unhappy
Negativo;to  beautiful ladies and so full of fun and body confidence. .. then on the s
Negativo;why is italian easier than spanish unhappy
Negativo;i find it so difficult to says no to him unhappy
Negativo;It's only been 3 days and to  nights since mama went back to the province but I already miss her unhappy
Negativo;i want to cry unhappy
Negativo;I love got7 but god i am bored unhappy
Negativo;i can't continue this right now because the lighting is shitty as f i swear sorry sad
Negativo;Let's have dinneeeer please unhappy
Negativo;I lost one import quizzz unhappy
Negativo;i want to be mutuals with you so bad unhappy
Negativo;Keep looking for the things I bought yesterday in my dream unhappy
Negativo;it hurts me to see him so sad unhappy  you don't understand i have to do this. if i don't kill you, he'll kil
Negativo;i hate park jisung so much sad
Negativo;When your online crush comes to the meet-up without their Snapchat filter unhappy
Negativo;I hate when my mom ask so you going or no? Bc then I want to stay home but i missed too much school already unhappy
Negativo;HAPPY BIRTHDAY KATRIKA  I miss you though unhappy  miss having you in our group and all haih  anyway, have a blast okay. love you!
Negativo;I miss my dogs too unhappy
Negativo;YG should have sent them to MCD. I want to see them holding the trophy unhappy  anyways
Negativo;DIGITAL MONSTERS WANT TO WORK WITH BLACKPINK MAKE IT HAPPEN PLS unhappy
Negativo;This is so me though
Negativo;i miss my boys unhappy  i have started working with my own local boys but they are very nervous college friends
Negativo;we were classmates for alvarez but i don't really see you around school anymore unhappy
Negativo;ugh i miss my baby crying
Negativo;if anyone needs me I'll be on my vent unhappy
Negativo;why is it so hard for you to notice me? Haay unhappy
Negativo;i cant deathmatch you piss off unhappy
Negativo;When are you going to notice yous? unhappy
Negativo;And I miss my bedroom too unhappy
Negativo;please take all the rest you needwe love you so so much :(i hope you feel better soon sunshine!
Negativo;oh, same unhappy
Negativo;I miss my baby unhappy
Negativo;it's only been a few days since their promotion ended but i'm already missing her so much unhappy
Negativo;i miss them unhappy
Negativo;i miss jihoon sad
Negativo;My only one cat yang manja sangat and now someone has took him unhappy
Negativo;Not tired and there's nothing to do great combo unhappy
Negativo;And this tweet made me cry!! crying
Negativo;back to coconut hair unhappy
Negativo;Please return the jacket unhappy
Negativo;who would you call when you are roused in midnightreminds me of the time(s) they were roommates unhappy  unhappy  unhappy YOU SUCK
Negativo;I feel so bad, and all the mobbing in Australia, I just hope everything goes right from now on unhappy
Negativo;it's only been a few days since their promotion ended but i'm already missing her so much unhappy
Negativo;hungry unhappy  but no time to buy food
Negativo;How can I set an alarm for 9am and snooze it until 12 unhappy
Negativo;Sad story unhappy
Negativo;Koalas are dying of thirst  and it's all because of us unhappy
Negativo;Hey screenshot sainyo  . Hmm tumagal sana us . Stay what uu are . Im always here fr uu no matter what  . Luv uu so mats
Negativo;Looks awesome Annette, but I can't make it unhappy  Thanks for the heads up though. Please take photos!
Negativo; narank 1 ako bcos of yoyou. can you please congratyoulate me even if its already late? unhappy
Negativo;it can't be over unhappy
Negativo;RELATABLE unhappy
Negativo;how about me unhappy
Negativo;Offline  unhappy
Negativo;heeeeey notice me unhappy
Negativo;i want to hang out with them unhappy
Negativo;he was talking with the girl behind jin unhappy
Negativo;I need cheering up, my dog who my family have had for 18 years is being put down tomorrow unhappy
Negativo;Molly  1. I wish I could have her hair unhappy  2. Cutest Michael girl  milly on the phone 3. HAIIIIIIR  and your lips 4. Friend5. Yes6. -
Negativo;even me unhappy  *hugs*
Negativo;I'm a building a LLVM backend so, I really need to build it unhappy
Negativo;I can't access my school emails from any web browser unhappy  Yet I have so much homework for all my subjects on there
Negativo;oh sad unhappy  goodluck!
Negativo;Ouch Elena Eremina's foot slip, that fall was a mess unhappy
Negativo;donny unhappy
Negativo;you're so rude unhappy
Negativo;oh my god same! we should attend on some lessons together sometime just kidding HAHAH
Negativo;Every time Meredith has flashbacks of Derek Shepherd I can't hold back the tears unhappy
Negativo;Whew! Can't asses myself unhappy
Negativo;But I no have round ass crying
Negativo;unhappy  i saw somebody said his hair fell out and bighit trying to figure it out
Negativo;koh, tolong bantu sampaikan keluhan ARMYs ke dong. Too many complaint here and there since day 1 of ticketing unhappy
Negativo;I keep waking up in the middle of the night sick as shit. unhappy
Negativo;I cringed so hard :(That fall was such a shame- she had been looking really good until that point...
Negativo;man its been about 2hrs since their vlive...its nearly over for sydney ppl... unhappy  goes so quick so appreciate every second!!
Negativo;Hi Aled, having no mobile signal sucks unhappy  What's the full postcode for where this is happening? We're keen to help SI
Negativo;That sucks unhappy
Negativo;I'm rusty.. Haven't played this game since I was like 10. Just kept dying at that crocodile part crying
Negativo;i really really need them right now unhappy
Negativo;Hey guys could you help me by retweeting this? I've heard was legitimate and I really need a VPN account rig
Negativo;GOD NOT THE KOALAS
Negativo;Feeling bad unhappy  with 89 others
Negativo;And this tweet made me cry!! crying
Negativo;I could write paragraphs about it xDShame its theoretically impossible in real life unhappy
Negativo;Thank you roshhh  i miss you and everyone too.  love youuu more
Negativo;Me too sweetie I know how you feel unhappy
Negativo;When your online crush comes to the meet-up without their Snapchat filter unhappy
Negativo;.the person who chose shut the fuck up: unhappy
Negativo;sadly yes. since he was expected to continue losing support before dropping bombs unhappy  going up when expe
Negativo;i hope this little beaand is andot overworkiandg himself and gettiandg at least some rest unhappy
Negativo;he could be whatever, so? sad
Negativo;But the dub is what I watch for Pokemon unhappy
Negativo;are dying of thirst  and it's all because of us unhappy
Negativo;Youngjae during fansign on 04/10/17 constantly massaging his back. Clearly something wrong but pretended he was not
Negativo;but... you use a purple flowercrown in your display picture unhappy
Negativo;i still cant unhappy
Negativo;well that's terrible unhappy
Negativo;Sorry piss off /3 unhappy
Negativo;I woke up at 4:17, I'm a joke unhappy
Negativo;So right! Sir Rob loves to torture us unhappy
Negativo;My salary reminds me of the weekends, I always know when it come but have no fucking clue how it goes unhappy
Negativo;i feel so sick today unhappy
Negativo;I wish but I can't sad
Negativo;its my birthday tomorrow baby unhappy
Negativo;I'm slow unhappy
Negativo;Super unhappy
Negativo;trashing others and having a possee behind you boosts your ego, but not your career. unhappy
Negativo;I just finished gym, had chopsuey before that unhappy  laughing my ass off humble feeds are always the bomb!
Negativo;Still not possible! unhappy
Negativo;whaaaaaaaat!!! You and unhappy
Negativo;You had loads of toys. All I had was a Sweep hand puppet AND the bastard lost its squeak! unhappy
Negativo;this is damn.... theres people who sincerely want to attend BH birthday party but bcs of those people who try for fun make them ca
Negativo;I should do aegyo because I lost unhappy
Negativo;Also please send prayers and sympathy because my favorite ball dress doesn't fit my boobs crying
Negativo;I miss snsd. I miss my girls unhappy
Negativo;Being a parent is very challenging. If we cannot control ourselves we'll give the worst output to the children In other word, Ngomel crying
Negativo;Jonny you and your poor legs make me so sad unhappy  hope you're okay
Negativo;Hope he's ok, poor mouse unhappy
Negativo;no its okay she survived :
Negativo;Yeah! My sight reading was pretty good in high school, but I'm a bit rusty now! unhappy
Negativo;Me to self: don't buy that.Also me: but I'm a furry unhappy
Negativo;this is damn.... theres people who sincerely want to attend BH birthday party but bcs of those people who try for fun make them ca
Negativo;i love youu so much unhappy  thank you, and have fun
Negativo;this is damn.... theres people who sincerely want to attend BH birthday party but bcs of those people who try for fun make them ca
Negativo;so upsetting the abuse these kids get unhappy   3
Negativo;Oo crying  // Happy3YearsBraceUnited
Negativo;exactly same in was thinking.. unhappy
Negativo;I'm scared unhappy  I mean. Why the heck did I decide to do laundry at 7:30 pm? What is wrong with me. Did I mention how dark it is. FML
Negativo;Sunnyside as well unhappy
Negativo;y'all want me to choke what'd I do? unhappy   (
Negativo;They have a whole Japan tour ahead of them.. One that will be quite brutal on their already tired bodies. Boys unhappy
Negativo; ahhh I'd be well chuffed, didn't even get an easter egg this year! unhappy  xx
Negativo;Can someone buy me a tasbih pls? I don't have one unhappy
Negativo;clay and hannah   - they were so in love they deserved to be endgame unhappy
Negativo;please talk to me about nct instant message lonely i need to fangirl once in a while okay crying
Negativo;this is so sad what the fuck unhappy
Negativo;Please follow me . I have been trying to get your follow for a long time unhappy  .
Negativo;I really enjoyed horrizion zero dawn but no idea what to play next unhappy
Negativo;this is damn.... theres people who sincerely want to attend BH birthday party but bcs of those people who try for fun make them ca
Negativo;No more good conversations here unhappy
Negativo;Annoyingly the spaces in the variable width version of the C64 font that's available on the internet are wi
Negativo;i don't like their songs after debyout younhappy  so i can syouggest yoyou jyoust one song i really love, it's Adore you
Negativo;Jackson unhappy  then Youngjae silence  aww
Negativo;trop retard sad
Negativo;i'd rather be sailor uranus but chibiusa but if thats everyone says i am unhappy  rip
Negativo;And you're right about McConnell as well. Unfortunately, we seem to have sold our government some time ago. unhappy
Negativo;I wish my dogs knew how much I hyped them up on snap chat unhappy
Negativo;some people  you intensionly  they don%27t even they please someone unhappy
Negativo;Very sad unhappy
Negativo;this is damn.... theres people who sincerely want to attend BH birthday party but bcs of those people who try for fun make them ca
Negativo;The most painful goodbyes are the onesthat are never said and never explained crying  unhappy  :/
Negativo;I miss BMF sad
Negativo;you're got to disappear half way too? unhappy  everybody want to being lazy eue
Negativo;+I have no choice but to cancel it. unhappy
Negativo;Oh sadly i wont watch her right now  they're forbid me to see her unhappy
Negativo;Koalas are dying of thirst  and it's all because of us unhappy
Negativo;R.I.P cellphone unhappy
Negativo;and  on the pic? unhappy
Negativo;yeah unhappy
Negativo;don't miss you anymore unhappy
Negativo;okay what TF is this colorful starbucks thing all over social media unhappy
Negativo;this is damn.... theres people who sincerely want to attend BH birthday party but bcs of those people who try for fun make them ca
Negativo;Well that's not good unhappy
Negativo;Oh boo, mine isn't in my inbox unhappy
Negativo;Didn't keep it unhappy
Negativo;I only just absorbed that I'm not going to get to laugh when he gets 2000 votes. unhappy
Negativo;Hi Ishwar! That's not the experience we want you to have unhappy  We will call you  for more details and sort it out! - Roshan
Negativo;We All Know unhappy
Negativo;I'll be as strong as I can but it's hard unhappy  xxx
Negativo;I lost two streaks and it's from my two favorite people silence  unhappy  good night
Negativo;I can relate to this so so much unhappy
Negativo;Joy we should get him back
Negativo;I can't do it all on my own. (See what I did there? )
Negativo;and they'll brush it off lng telling others not applicable not applicableg-iinot applicablerte lng sila and that other had it worse than them. unhappy
Negativo;usually a speedboat behind any we get here on the river unhappy
Negativo;Omg I see why you don't drink alcohol Haha so glad your having fun all you guys ! Wish I
Negativo;This happens ALL the time!  unhappy
Negativo;0 motivation to study unhappy
Negativo;happy birthday sweet sweet girl! i hope you have the best day ever! love and miss you so much unhappy
Negativo;NMD R2's so ugly unhappy
Negativo;my honey unhappy
Negativo;philippines? unhappy
Negativo;I want to but I wouldn't be able to get time off for it and don't know people in my year to go with unhappy
Negativo;unhappy  friendzone. damn sad
Negativo;I cried so much, I was a mess. I went to bed feeling numb it was awful unhappy
Negativo; [PLEASE RT] he'll buy me a blinking taehyung headband, if i get 900 retweets and 900 likes. help me :(un
Negativo;the email I was hoping I'd get today, didn't arrive unhappy  here's hoping tomorrow it does
Negativo;Haha mate its all good I love a debte I just wished the center
Negativo;wowwow these are all so cute unhappy  i wantt
Negativo;That sucks unhappy
Negativo;instant message getting sad unhappy
Negativo;wow unhappy  people are so mean
Negativo;this is damn.... theres people who sincerely want to attend BH birthday party but bcs of those people who try for fun make them ca
Negativo;talking to my over driver about where I'm goinghe said he'd love to go to New York too but since Trump it's probably not
Negativo;I love them with all my hort unhappy
Negativo;Golly gosh. This is simply dreadful What havoc must be wreaking subsurface? Black salve won't
Negativo;Autograph book at the ready, no sign of Garry Barlow yet sad
Negativo;Thank you roshhh  i miss you and everyone too.  love youuu more
Negativo;please meeeee you have followed me for almost to  years now unhappy
Negativo;what happened unhappy
Negativo;True! Khilado kuch unhappy
Negativo;realized i havent eaten rice maghapon because i finished 3 packs of spicy seafood noodles + to  extra big chilimansi :(acid attack right now
Negativo;Post-show blues are hitting hard. unhappy
Negativo;all ready for its poster - when my computer gets
Negativo;good morning unhappy
Negativo;Wht sort of thing (can't use word person for it)can cause such suffering to ths sad
Negativo;i want to kiss his nose and tell him i love him sad
Negativo;i stayed 3 hours on the phone with aD my bubbyyyyyyy i miss her unhappy
Negativo;No girl unhappy  that's why. Wa ropiwa 1. Sandton is unnecessarily expensive2. Try salons in Braam.
Negativo;I was actually looking forward to seeing if your theory around his personal vote was correct unhappy
Negativo;Who to bring to MB man unhappy
Negativo;I am sad to report that the robins egg my mom found in the yard after a storm has been taken off life support. Poor thing is too frozen unhappy
Negativo;Her back unhappy
Negativo;slight buzy kasi besh unhappy
Negativo;When you're late to work because you had to break the news to the lovely lady who cleans the house... crying together unhappy
Negativo;They stopped having them when they got rid of the toy surprises at the bottom unhappy
Negativo;tell me unhappy  why
Negativo;i cant find my striped shirt unhappy  so instant message wearing the one that says what is your favorite thing? with lucas in the middle
Negativo;Guys please help me retweet unhappy
Negativo;there's always shit like this. there's always people who are less deserving getting tickets, and winning giveaways etc unhappy
Negativo;truuuu!! si grim reaper and sunny huhu grabe love story nila unhappy
Negativo;I caught a cold. unhappy  It seems I've got tired than I expected....
Negativo;Shameful, shameful business :(Stop paying giant corporations for foods you just don't need.... wake up people plea
Negativo;I miss my baby unhappy
Negativo;HOLY SHIT! 40 pages script of the opening scene of Man Of Steel on Krypton got compressed.I wish I could at least
Negativo;Late nights
Negativo;I face swapped a cat with a dog and it's really upsetting unhappy
Negativo;failed unhappy  .g hehe
Negativo;I miss my boo so much unhappy
Negativo;I need a car unhappy  but no car unhappy  poor me unhappy
Negativo;I wish i could attend it too unhappy
Negativo;ikr. I would have trauma if i ware him unhappy
Negativo;4/20 today, but it wasn't lit at all unhappy
Negativo;why is life so unfair? unhappy
Negativo;The biblical lectures are coming. More notification soon. Tomorrow, in fact.
Negativo;I'm so glad I don't care what people think anymore but I wish I still looked my best everyday like I used too sad  I just pick
Negativo;MUZ U MORE, SURE NO PROB. ILABYU TOO
Negativo;Such a lucky slave i wish this was me unhappy
Negativo;instant message still hoping unhappy
Negativo;fuck unhappy
Negativo;i tak ambik wedding package cause i is poor unhappy  i ambik aromaterapi massage je hajxjsjsj. Hehe see uuuu jwa
Negativo;Koalas are dying of thirst  and it's all because of us unhappy
Negativo;unhappy  let's fight all those kids
Negativo;it's not cassandra cain. unhappy  not sure i want to watch batbuffy. batwoman would have been more interesting.
Negativo;Half of the time it doesn't load, the other half of the time it crashes unhappy  It's embarassing when I'
Negativo;right i don%27t see how people can just do shit like this
Negativo;i miss hoseok unhappy
Negativo;Left few months in HinHua ler unhappy  I need to gambateh wink
Negativo;A fish killer going to be pressed younhappy  I the hoe of today you were a  GOOD person
Negativo;She loved Beth so much unhappy
Negativo;prince baekhyun.....throw me into the dungeon please i don't deserve to see your beautiful face unhappy
Negativo;They are family.  It's awful when they go.  Sorry to hear. unhappy
Negativo;I face swapped a cat with a dog and it's really upsetting unhappy
Negativo;my honey unhappy
Negativo;We all do unhappy  Pizza in Taiwan! Its like a swift, flavorful dream
Negativo;Can't :(Tello
Negativo;Swear I just walked past haha, didn't get a chance to say hi unhappy
Negativo;I miss quacktopia! unhappy
Negativo;are dying of thirst  and it's all because of us unhappy
Negativo;Goodnight I love these beautiful boys unhappy
Negativo;Why no available in the U.K.? unhappy
Negativo;Ailes sure knew how to make a great network!  Fox is going downhill wi
Negativo;penge damit unhappy
Negativo;I'm sorry unhappy
Negativo;Koalas are dying of thirst  and it's all because of us unhappy
Negativo;i'm hungry unhappy
Negativo;Finals are next week unhappy  wish me luck x
Negativo;I miss Temperance Brennan and Seeley Booth so much unhappy
Negativo;I miss quacktopia! unhappy
Negativo;I said D2 largely because SD D2 doesn't run on newer versions of Mac OS and I miss playing it unhappy   HD woul
Negativo;follow mee plss unhappy
Negativo;talking to my over driver about where I'm goinghe said he'd love to go to New York too but since Trump it's probably not
Negativo;Babye old twitter unhappy
Negativo;congratyoulations Harry!!!!! Been with you since fifa 13!!!! Miss yoyour younboxing videos unhappy
Negativo;can't wait to see you in that film Karl! I wished you would be here were I'm bu
Negativo;Cram reading unhappy
Negativo;I'm job searching and got none so:(ButHedonism i got in abundance
Negativo;it's only been a few days since their promotion ended but i'm already missing her so much unhappy
Negativo;Hello I am getting cyber bullied by do something about it unhappy
Negativo;Call center nice game 4/20 unhappy
Negativo;BES RIP
Negativo;Follow me too unhappy
Negativo;I'll be attending cosmic latte on saturday and i'll give these out to selu shippers KASI SELU MONTH QAQO unhappy
Negativo;baby unhappy
Negativo;I only just absorbed that I'm not going to get to laugh when he gets 2000 votes. unhappy
Negativo;friendly fire to wings tour unhappy
Negativo;my back hurts sad
Negativo;Typed up all the medical  shorthand abbreviation we use for work, and the dame computer decides to crash unhappy  now I...
Negativo;excuse me i don%27t see my nama unhappy
Negativo;this is damn.... theres people who sincerely want to attend BH birthday party but bcs of those people who try for fun make them ca
Negativo;That's shocking and evil unhappy
Negativo;Zac farro is back By the way hehehe So sad Jeremy is not unhappy
Negativo;Maa ki kuss tumhari. Now take this bullshit you loser.
Negativo;I thought mountain dew in Australia had no caffeine and it was the little energy drink cans were caffeinated I will never sleep again unhappy
