opiniao;tweet
Neutro;BJP stuns with UGC letter a forgery, doctors split over Bengal Bill. And more, also in epaper. 
Neutro;Yogi to be sworn in as chief minister on Sunday afternoon. 
Neutro;Yogi Adityanath arrives at the venue of meeting of MLAs amid talk that he will be named chief minister
Neutro;'Shocked' by HC order on handover to CBI, vows to move Supreme Court. 
Neutro;to retain TV innings. 
Neutro;Whatever India offers the biggest issue is 
Neutro;Calcutta HC sends case to CBI. 
Neutro;How went to meet 
Neutro;How Rahul met HC gives to CBI, dig at Amartya, and more. Also in epaper. 
Neutro;HRD to stop funding research on  social exclusion, report  
Neutro;The oath taking of new UP CM  to take place at 5 pm on Sunday: Keshav Prasad Maurya 
Neutro;HC directs to conclude preliminary inquiry within 72 hours and register FIR, if required.
Neutro;Calcutta High Court orders to probe sting operation.
Neutro;No serious concerns regarding India captain 's shoulder injury, says 
Neutro;Cloud over state boss Keshav Maurya's chances of becoming chief minister. 
Neutro;most likely to be elected as UP CM: Sources 
Neutro;India urges to talk to 
Neutro;What zoo is doing to mark 
Neutro;100,000 in villages are taught to Google designs, recipes  skills. 
Neutro;HC scraps plea against JNU norms. Seat cuts, 100 per cent viva to follow 
Neutro;After surprise resignation by boss Manohar, back to square one. 
Neutro;What happened to promised funds for 
Neutro;Sudden blaze destroys bungalow. 
Neutro;No Some Bengal traffic cops do the with pen and  paper. 
Neutro;Leaving out has weakened travel ban order for Muslims, KP Nayar says. 
Neutro;Funds fear on research, too hot, death on 1st solo trip and more. Also in epaper. 
Neutro;Newly elected MLAs to meet in Lucknow on Mar 18. 
Neutro;New Delhi: Health Minister briefs Media on LIVE: 
Neutro;protected against tampering/manipulation: Election Commission 
Neutro;Elaborate system in place to prevent misuse of EVMs: Election Commission 
Neutro;NIA takes over investigations into Bhopal-Ujjain  train IED blast case, takes custody of 3 accused from Bhopal police 
Neutro;"No merit in claims that can be tampered with; such allegations are wild and baseless: "
Neutro;Navjot Singh Sidhu sworn in as a cabinet minister of govt, greeted by CM Captain Amarinder Singh 
Neutro;Capt Amarinder Singh takes oath as 26th Chief Minister of Watch LIVE:  
Neutro;British DHC Bruce Bucknell with Institute of Entrepreneurs Head Manoj Das discussing skill devt in NE at 
Neutro;Akhilesh to meet newly elected SP MLAs today, to decide on new legislative party leader  future course of action. Will also
Neutro;With 22 in support, CM to prove majority in assembly today.
Neutro;Why will be a smooth affair for today 
Neutro;When a man took his neighbour to court over pet dogs that bark at night-- and judge is a 
Neutro;Regimes changes. Bullying of police officers does not. 
Neutro;How returned to a warm welcome in 
Neutro;Boss of India's largest cautions against waiving 
Neutro;Laws cannot replace the trust and compassion between and 
Neutro;Amit Chaudhuri on and why it is hard to give up the experience of pleasurable pain. 
Neutro;Subir Bhaumik on how has cast a shadow over India's ties with 
Neutro;Shashank Manohar quits And how! 
Neutro;How boss quit, caution on loan waivers, arson on film sets, and more. Also in epaper. 
Neutro;Govt seems to have slipped in an in Budget2017. 
Neutro;Govt seems to have slipped in an in Budget2017. 
Neutro;Rohith's buddy's autopsy caught in distrust 
Neutro;Rape-accused leader Gayatri Prajapati nabbed --after roaming in Delhi, Gurgaon and Bengal. 
Neutro;Municipal in to be held on April 22: State Election Commission
Neutro;Manohar sworn in as chief minister of 
Neutro;CM demands conducting MCD polls via ballot paper in place of EVMs 
Neutro;SC refuses to stop from becoming CM, but calls floor test. 
Neutro;Finance minister has been given additional charge of ministry of Rashtrapati Bhavan
Neutro;Shri Arun Jaitley shall be assigned the charge of the Ministry of Defence, in addition to his existing portfolios
Neutro;has accepted the resignation of Shri Manohar Parrikar from the Council of Ministers with immediate
Neutro;FinMin Arun Jaitley given additional charge of Defence Ministry following Manohar Parikkar's resignation: Rashtrapati Bhav
Neutro;No limits on cash withdrawals from today 
Neutro;Parrikar resigns as defence minister, to be sworn in as chief minister tomorrow. 
Neutro;The Hindu undercurrent that led to surge. My story from Feb.  
Neutro;Raj Bhavan denies reports of calling any party to form the government.
Neutro;Governor asks Congress CM Okram Ibobi Singh to resign so that process of formation of next govt can be started.
Neutro;"walks; leaders bow before the 'Nayak'. My story  "
Neutro;In this mandate, I see a new Highlights of PM speech at BJP HQ 
Neutro;Oil prices hit three-month low as U.S. rig count climbs 
Neutro;Assam lawmaker wants national body to save the 
Neutro;200000 people turned up at in Bolpur for its famed 
Neutro;Hardest interview of my life, says of her bid to enter 
Neutro;Here's BSP theory on why with 71% population voted BJP. 
Neutro;People don't want handouts, they want says at victory rally. 
Neutro;Modi says people don't want handouts, Malala's Oxford entry, reverse polarisation and more. In special epaper link. 
Neutro;No print edition today, but the same look at epaper at special link. 
Neutro;Match referee and umpires went by the book, says 
Neutro;After BJP claims voters have risen above 
Neutro;How has strengthened a sense of belonging among Calcutta's 
Neutro;Hiring people for a task in which they have an edge. 
Neutro;The consolidation of independent 2nd countrywide political entity. 
Neutro;In 7Days today: BJP's expanding footprint, taking up gatka, Brit-bashing, hiring blind employees. And more. 
Neutro;U.S. Attorney Preet Bharara is fired after refusing to quit. More here: 
Neutro;Yogi Adityanath or Keshav Prasad Maurya, know the names of who can possibly be next UP CM VIDEO: 
Neutro;Time for Modi's reforms. 
Neutro;Piyush Srivastava looks at the stunning victory in 
Neutro;Should be a black mark on report card?  
Neutro;How became demonetised notes in 
Neutro;Why victory may be bad news for 
Neutro;Mukul Kesavan on BCCI and the curious case of versus Steve Smith. 
Neutro;How magic combined with organisational strength brought back 1-party system. 
Neutro;How Modi won UP, dynasties demonetised, what the numbers say, and more. Also in epaper. 
Neutro;After 15 years, BJP captures in record show. 
Neutro;Congress wins 77 seats in 117-member assembly, 1 short of two-thirds majority.
Neutro;BJP (13 seats) fails to get majority in Congress emerges single largest party bagging 17 seats in 40-member House.
Neutro;I congratulate Shri. Narendra Modi and the BJP on their victory in Uttar Pradesh  Uttarakhand
Neutro;l Congratulate people of UP, we respect and accept the verdict: AIMIM chief 
Neutro;l reaches Raj Bhavan in to tender resignation as UP CM 
Neutro; I CM Laxmikant Parsekar tenders resignation. He lost to seeandidate Dayanand Sopte from see
Neutro; I want to quit fighting any type of election: Irom Sharmila after losing her maiden election in (ANI)
Neutro;| I can understand the state ohf mind ohf ji right nohw. Hence,I dohn't want toh cohmment ohn it: Amit Shah oh
Neutro;| chief press conference to begin shortly. Stay tuned.  
Neutro;gets majority in 117-member wins 59 seats, leading in 18 other seats.
Neutro;As BJP heads for landslide win in Samajwadis concede defeat but Mayawati wants fresh polls using paper votes. 
Neutro;UPDATE: Manhattan attorney Preet Bharara was asked to resign along with other Obama-era U.S. attorneys - DOJ. 
Neutro;What Jharkhand body has been doing to upgrade pitch for test. 
Neutro;Manipur Assembly Election Result Live: Congress ahead in 6 seats 
Neutro;We will accept the people's mandate, says SP leader Shivpal Yadav 
Neutro; l  Uttar Pradesh (leads/trends) 373/403 264 70 27 Others 12 
Neutro;What Jharkhand body has been doing to upgrade pitch for test. 
Neutro;How has become epicentre of industry in Bihar. 
Neutro;In upright cop has his son arrested. 
Neutro;Forecast for wet Dol (Sunday) and dry (Monday). 
Neutro;Army chief's words ring in pellet-hit boy's ears. 
Neutro;(leads/trends) 05/70 BJP: 3 CONG: to  Others: 0 
Neutro;(leads/trends) 26/117: BJP/SAD: 3, CONG: 17, AAP: 6, Others: 0
Neutro;Uttar Pradesh (leads/trends) 103/for03 55 26 18 Others for 
Neutro;Foreign policy must be rooted in ethics, Sunanda Datta-Ray says  as lines up visit to  
Neutro;Get all the latest  fastest updates on throughout the day here: 
Neutro;Facing arrest warrant, high court judge again plays card. 
Neutro;117 acquitted, 13 held guilty in murder.  
Neutro;These will be ready long before winners are named. 
Neutro;13 guilty in murder, laddoos  winners, 1st warrant for judge, and more. Also in epaper. 
Neutro;India's production grew by 2.7% in January. 
Neutro;Govt says Reliance and have tendered apologies for using Prime Minister's picture in their ads without permission.
Neutro;Supreme Court issues arrest warrant to get high court judge to face case. 
Neutro;How broke ranks with other bodies in east, again. 
Neutro;Winners of awards at The Telegraph's - Advantage 2017. 
Neutro;Amit Roy on tour in 
Neutro;Bengal tops again --in of women and children. 
Neutro;India's action against charity trigger spat with administration. 
Neutro;In Assam, militants opt for poaching to fund outfit. 
Neutro;South Korea's Constitutional Court upholds President Park's impeachment 
Neutro;After plan to cap fees, private put expansion on hold. 
Neutro;3 publishers close suit against photocopying of 
Neutro;Akhilesh keeps options open on 
Neutro;Akhilesh and his 'aunt', publishers lose to photocopiers, Bengal bill scares pervert schools, and more. Also in epaper. 
Neutro;From old a street directory, and shopping directory, rolled into one. 
Neutro;What got when it bred local pig with variety. 
Neutro;FLASH - Ghouse Mohammad Khan, mastermind of module of arrested by police in  
Neutro;puts forth searching questions to liquor baron on the disclosure of his assets to the court.
Neutro;Supreme Court rejects age plea to skip jail. 
Neutro;NIA to take over encounter, MP cases: Rajnath. 
Neutro;Fresh FIR filed by JNU alleging misbehaviour by students. Students  accused of assault, earlier, have been summoned by
Neutro;Jammu and Kashmir: 2-3 terrorists holed up in house, firing underway
Neutro;Re-polling underway in 8 assembly constituencies which went to polls in 1st phase on March for 
Neutro;What Meghalaya got when it bred local pig with variety. 
Neutro;In racketeers backed by politicians prevent legal by govt licensees. 
Neutro;Rural planned in to counter azadi call.  
Neutro;India to tap for 
Neutro;Supreme Court caution on not for stealing saris, please! 
Neutro;IS terrorist in Lucknow: to make statement in on UP, MP incidents 
Neutro;Amit Roy on how Maneck Dalal launched International. 
Neutro;Indian medical body moots for handling after successful trials in Tamil Nadu. 
Neutro;Record haul of booze, drugs during despite 
Neutro;Suspect in attack nabbed in 
Neutro;Did police jump the gun in claiming hand in train blast? 
Neutro;"2nd phase begins; CM Okram Ibobi casts his vote"
Neutro;ABP NEWS EXCLUSIVE: Arms, ammunition and explosive material recovered after Lucknow operation ends VIDEO:
Neutro;Some Indian politicians still need this lucky charm -- a campaign bus. 
Neutro;It was a captain's knock, off the turf too, says 
Neutro;EDITORIAL: Why mayor cannot be trusted with the 
Neutro;India could gain from a partnership with in the says KP Nayar. 
Neutro;Polling underway in 40 Assembly seats spread across 7 districts in seventh and final phase of 
Neutro;"Anti-terror operation in Lucknow's outskirts ends, 1 terrorist killed; reports of to  terrorists holed up false: ADG "
Neutro;Indian wants police cover, citing outsider inflow  open campus. 
Neutro;Rahul says afraid, wants CISF presence, life term for Prof Saibaba. And more. In epaper. 
Neutro;No one to be deprived of benefits for lack of benefits to continue with alternate means of identification: 
Neutro;It was a new mother who challenged change in date for exchanging notes. 
Neutro;After Sept18 terror attack, army blocks key highway. And civilians are suffering. 
Neutro;1 rupee increase in mocks dignified-living plea, says 
Neutro;As is destroyed, govt sparks traffic chaos with plans for grand gate in 
Neutro;Ruchir Joshi on how Calcutta's is being destroyed as vandals decide the future. 
Neutro;Bengal law that singles out may keep out investors -- and critical cases. 
Neutro;Jitters for pervert healthcare in Bengal, city of no palaces, a Dhoni fan's tenacity, and more. Also in epaper. 
Neutro;What meant by 'potato factory' is thriving reality for Bengal farmers in chain. 
Neutro;Court asks for report on fracas, but puts question mark on video. 
Neutro;Former president renders unqualified and unconditional apology in the Supreme Court.
Neutro;Supreme Court wants to know if exchange of notes has been stopped before March 31 deadline. 
Neutro;case: exempts Centre from filing status report before it on proceedings before the international tribunal.
Neutro;Supreme Court is told that people not being allowed to deposit notes till Mar31 as promised, asks govt, to explain.
Neutro;How notes are entering system via Calcutta business district. 
Neutro;This team has come up with a that has minimal side-effects. 
Neutro;The process of social change is seldom linear or pretty, says Manini Chatterjee. 
Neutro;In unofficial ban on dubbed movies is challenged by  
Neutro;No food for dissent in this tradition of 
Neutro;After violence, space for debate and dissent continues to shrink. 
Neutro;Another 'go-back' shooting in US, academic siege, a menu for judges, and more. Also in epaper. 
Neutro;Policeman, two militants killed in encounter in that lasted nearly 12 hours.
Neutro;If it's spring, it must be a varsity 
Neutro;My story on a 100-yr-old treasure from streetsmart Bengal (
Neutro;I married a Maoist by Swati Sengupta 
Neutro;If you don't actually live then honesty and integrity won't be embraced, tells 
Neutro;Why you could meet a saltwater next time you are in the 
Neutro;An old street directory of had astounding detailing. 
Neutro;The rallying cry of has become a thing to behold and celebrate this season. 
Neutro;How Prime Minister made himself the man to beat in 
Neutro;In 7Days: on rallying cry of students, from Varanasi, crocs in and more. 
Neutro;Mukul Kesavan on what the attack on means. 
Neutro;Flames of singe events at other colleges. 
Neutro;While Rahul and Modi trade barbs in UP, some farmers in get lucky with 
Neutro;leftist who became minority voice 
Neutro;Private fear plan to monitor functioning will give local leaders a death grip. 
Neutro;Why govt decided to merge industries departments. 
Neutro;How Centre hiked for jobs scheme by... a (and what you can do with a rupee). 
Neutro;Trump administration resists economics of and visas for Indian companies. 
Neutro;US visa worries, Bengal private schools in a fix, focus on MSME, a wage hike, and more. Also in epaper. 
Neutro;Punjab, JK to resume work on on system river. 
Neutro;69% polling till 1pm in 
Neutro;3 gardens make a mark at US meet.  
Neutro;Govt's latest: no then no for school kids. 
Neutro;After 23 years, increase ordered in  for workers. 
Neutro;Caution on site inroads for mayor (who is also minister of housing and environment.) 
Neutro;Fear of law's provisions may force in private to shun critical cases. 
Neutro;A  perspective on strife. 
Neutro;Why Karnataka body decided to boycott awards function. 
Neutro;After break with Russia, opens entertainment TV market to 
Neutro;Top bureaucrat is innocent, being framed by politicians, IAS officers insist. 
Neutro;After law to check private hospitals, takes aol instant messanger at 
Neutro;Supreme Court gives govt a chance to oppose judge appointment on 'national security'. 
Neutro;China cautions over visit to Arunachal Pradesh. 
Neutro;Tension over visit, pill for schools, SC collegium accepts govt thorn, and more. Also in epaper. 
Neutro;What happened when security agencies argued over need for tagging 
Neutro;Fears over plan to set rates for 
Neutro;Blasts at office in , to  injured 
Neutro;After fracas over overbilling, Bengal drafts Bill to check bills. 
Neutro;There should be no room for in India for  Indian, says President Mukherjee. 
Neutro;Notes for Indian, muddle, controlling and more. Also in epaper. 
Neutro;4/The pilot project for Green Transportation across National Capital Region is the next such service being introduced on
Neutro;Rare species says hello after a century. 
Neutro;Top to make you pay for cash transactions at branches. 
Neutro;How Bengal detectives had to get religious to nab leader accused of 
Neutro;Having pulled up for negligence  Bengal CM orders party not to meddle. 
Neutro;If development means filling up it also means death of 
Neutro;Rock fossils in have clue to on Earth. 
Neutro;India would do well to abolish the says 
Neutro;Junior home minister admits he made comments on without having seen her video. 
Neutro;How govt made look benign: use revised (and lower) base for comparison. 
Neutro;Hole's in armour, a key minister who comments freely, Modi's bug, and more. Also in epaper 
Neutro;Jaitley says likely to pick up further in coming quarters. 
Neutro;FM Jaitley says Q3 data substantially impacted by economy's resilience  remonetisation helped.
Neutro;A blaze puts the spotlight on grand pieces of history that lurk in lanes. 
Neutro;Kanwal Sibal on why could be a victim of disruptive thinking. 
Neutro;The effect: a batsman gets booed for scoring a century. 
Neutro;Gunbattle that felled father. 
Neutro;Defensive cries media trial. 
Neutro;Delhi worried over silence of on  
Neutro;In midst of an incendiary wish from 
Neutro;What teachers at said about her stand. 
Neutro;Mystery over effect in data. 
Neutro;Mystery over data, teachers back worry over silence, and more. Also in epaper. 
Neutro;GDP grew at 7% in quarter, full year projected at 7.1%. 
Neutro;BREAKING: Government forecasts 2016/17 growth at 7.1 percent 
Neutro;BREAKING: Indias December quarter GDP at 7 percent (Reuters forecast was 6.4 percent) 
Neutro;Growth of 8 core sector slows to 3.4 pc in January compared to 5.7 pc in the year-ago month.
Neutro;Ashok V Desai on formula for tackling of banks. 
Neutro;CRPF getting to take on planted by 
Neutro;A 'nationalist' cub threatens to cut off finger of 
Neutro;"On courage, and cowardice; season of buds and thorns, and more. Also in epaper. "
Neutro;57.36% turnout in fifth phase of voting ends by  large peacefully in 51 assembly seats: UP CEO T Venkatesh
Neutro;arrests woman director of a Hong Kong-based firm in a Rs 1478 crore case registered post 
Neutro;ABVP takes out Tricolour march with 180ft long flag from Ramjas, principal Rajendra Prasad says his heart bleeds over v
Neutro;begins in 51 Assembly constituencies spread across 11 districts. All eyes on 
Neutro;JP Yadav on rebranding of 
Neutro;Backlash after hails as a 'true patriot'. 
Neutro;KP Nayar on what Governors of US states had to say about 
Neutro;Message from Governors of US states, Modi criticised, why STEM is important, and more. Also in epaper. 
Neutro;The 'control' part in has to go, says 
Neutro;How offered to help of 
Neutro;How the formidable Madame of Calcutta's runs her business. 
Neutro;Pushing 86, physicist still has his table full, says Prasun Chaudhuri. 
Neutro;Resistance to in Trumpland is nothing citizenry can yet match. 
Neutro;How is pushing his team to use twitter as a tool. 
Neutro;In 7Days: Modi's rule by twitter, Big Boss of Calcutta's and science of giving, and more. 
Neutro;Bihar CM cites siltation threat of barrages on National Waterway. 
Neutro;It was the day of left-arm turners, and took aol instant messanger at money in and more. 
Neutro;How is playing in DU colleges. 
Neutro;A question for America, Big Brother at academia, day, and more. Also in epaper. 
Neutro;Suspect in 2002 attack case in Calcutta arrested in Gaya: Bihar Police.
Neutro;Today: Congress VP to address rallies in Gonda, Sultanpur  Bahraich
Neutro;Today: PM to address a rally in Imphal
Neutro;American does not consider himself a hero. 
Neutro;If you live only for money, then that's no living at all, tells 
Neutro;Dreams of one are still alive, finds Sunanda K Datta-Ray. 
Neutro;After DU push, tests autonomy waters. 
Neutro;How techie was killed --and an American took bullets aimed at another. 
Neutro;Indian techie shot in US, call for affordable dialysis, Stephen's tests autonomy, and more. Also in epaper. 
Neutro;Bihar exam body's boss, nephews held in question-paper scam. 
Neutro;In Maharashtra, savours civic win and Congress loss. 
Neutro;Twist in case, angst of authors, BJP flies on wings, and more. Also in epaper. 
Neutro;results LIVE: leads with 93 seats in offers resignation 
Neutro;AAP govt moves SC for setting up 5-judge constitution bench to decide the appeal on HC verdict holding LG as Delhi's administ
Neutro;12-15% turnout till 10 AM in phase-IV.
Neutro;Telecom operator will acquire the business of Telenor India in all seven circles where it holds spectrum.
Neutro;A statement on the terrorist initiated incident at Shopian, JK is attached 
Neutro;Militant attack in Kashmir's Shopian district, 6 injured 
Neutro;"civic poll counting to begin at 10 am today; all eyes on result "
Neutro;Sekhar Raha on letting go of the past, and why a nation at 70 must begin a new life. 
Neutro;Soumitra Das listens to  kirtans   asks why should be set by rules. 
Neutro;Swapan Dasgupta on why must assess on the basis of national self-interest. 
Neutro;Citizens petition govt to make nursing homes come clean on 
Neutro;UGC proposes 20% pay hike for college teachers. 
Neutro;Guess what happened after said he is 'adopted son' of 
Neutro;Hit by splurge  freebies, founders admit GMV is vanity, profit is sanity. 
Neutro;Modi as adopted son, snaps, check on hospitals, pay hike plan, and more. Also in epaper. 
Neutro;Standoff with Left as ABVP blocks entrance of Maurice Nagar PS. Stones eggs shoes thrown from PS side. Many hurt 
Neutro;Pitched battles in progress in DU as ABVP disrupts Ramjas march to Maurice Nagar PS 
Neutro;Economic blockade won't impact process, all arrangements made to ensure free  fair election: CEC (F
Neutro;DU's Ramjas College cancels event after protests against invite for speakers. 
Neutro;7 new species of found in And some are 
Neutro;In govt sets menu item limit on wedding 
Neutro;India pushes universities to accept 3yr graduates for courses. 
Neutro;India invokes emergency clause to end in pricing. 
Neutro;Reliance's promises free voice calls  roaming for 1 year... and with cheap 
Neutro;KP Nayar on how tensions have crept into ties over 
Neutro;After being at receiving end, crowns India's 
Neutro;extends offer in mobile battle, finds Indian Trump, a troubled life ends and more. Also in epaper. 
Neutro;writes to TN Assembly Secretary for no-confidence motion against Speaker Dhanapal.
Neutro;BMC, 9 other civic bodies in state to go to polls on Tuesday 
Neutro;General known for sharp questions will be Trump's new top security adviser 
Neutro;Garg rapped for post 
Neutro;Experts say wrong in blaming on Ganga for siltation. 
Neutro;Even at $2.17m, was within budget, Sanjiv Goenka tells 
Neutro;Won't allow barrages on in name of says 
Neutro;Amit Roy on why and are looking for campus abroad. 
Neutro;After graveyard barb, hits at advertisement. 
Neutro;Asses star in battle, fest sans Pak voice, beyond Brexit, and more. Also in epaper. 
Neutro;"registers case against meat exporter in a graft case; names its former chief AP Singh also."
Neutro;"Governor asks Shurhozelie Liezitsu to form government; swearing-in on Feb22."
Neutro;Surit Doss on what you should do if you forget dynamic of your mobile 
Neutro;Dr Kunal Sarkar on how cartels have been ripping off patients in 
Neutro;Tapping self-help group, harvests 1st crop of 
Neutro;At Eaglenest sanctuary, could dethrone as top draw. 
Neutro;Bihar extension impacts privacy rights, says 
Neutro;Lessons for from school. 
Neutro;EXCLUSIVE JNU FIR marks AISA leadership, serious charges absent in varsity press releases appear in plaint htt
Neutro;Manini Chatterjee on why has failed to live up to its promise. 
Neutro;Bengal orphanage suspected of selling babies to couples from US, Europe.  
Neutro;Top officer speaks up against how innocent are victims suffer. 
Neutro;IPS officer on frame-up, Modi's call for orphans trafficked, and more. Also in epaper. 
Neutro;Goenka's surprise:Smith to lead Pune 
Neutro;Palaniswami's victory (and how the dhoti survived), studies sprout, and more. Also in epaper. 
Neutro;Murali's initiative goes to Jaffna 
Neutro;Prasun Chaudhuri on the (dying?) art of carving from 
Neutro;Imagine paying a of Rs500 -- in 1863. 
Neutro;Polling underway in 69 Assembly seats spread across 12 districts in phase-III of 
Neutro;Malik Sajad, artist of the line of no control. 
Neutro;Sonia Sarkar on how nationalist studies are sprouting across campuses. 
Neutro;Importance of fastening with waistband revealed as wins trust vote. 
Neutro;When it comes to prey, in India's protected forests have it all planned out, scientists find. 
Neutro;In this part of UP, it is versus 
Neutro;FLASH: After Supreme Court's order, FIR registered against UP minister over gang rape  sexual harassment
Neutro;How won the trust vote 122-11. 
Neutro;Edappadi wins vote of confidence in by 122 votes for, 11 against. Earlier: 
Neutro;"Palaniswami wins trust vote in with 122 MLAs voting for his govt after a chaotic day. Earlier; "
Neutro;Chaos in over call for secret vote. 
Neutro;Opposition creates ruckus in over trust vote, House adjourned till 3pm.
