opiniao;tweet
Positivo;An inspiration in all aspects: Fashion, fitness, beauty and personality. :)KISSES TheFashionIcon
Positivo;Apka Apna Awam Ka Channel Frankline Tv Aam Admi Production Please Visit Or Likes  Share :)Fb Page :...
Positivo;Beautiful album from  the greatest unsung guitar genius of our time - and I've met the great backstage
Positivo;Good luck to Rich riding for great project in this Sunday. Can you donate?
Positivo;Omg he... kissed... him crying with joy
Positivo;happy anniv ming and papi!!!!! love love happy
Positivo;thanks happy
Positivo;C'mon Tweeps, Join  vote for the singer! Do spread the word. :D
Positivo;Thanks for the great review! smile
Positivo;Yay another art raffle! Everything you need to know is in the picture :D
Positivo;Hello I hope you visit Luxor its amazing city in Egypt pleas check
Positivo;We got a Vive tracker in the office and our intern, went to work.Don't get too excited, this isn't
Positivo;Take a look at favourites.io You can do this and more happy
Positivo;Go back to school for music! I think I will in time happy
Positivo;Sixth spot not applicable Team! Higher pa! :)KISSES TheFashionIcon
Positivo;thanks for being top influencers in my community last week happy
Positivo;Share the love: thanks for being top new followers this week happy  Want this?
Positivo;retweet this tweet if you want your to be included in the nhc scrapbook!! i'll be making something out of all of the usern
Positivo;Happy 420 happy  pass it to your followers!
Positivo;Who wants some good vibes? Watch this on YouTube or TV100 application now for FREE happy
Positivo;Great to work with you too such a lovely place! Thank you for havin
Positivo;Nothing is ever as it seems. What looks bad today, will be a blessing tomorrow happy  Keep your faith stirred up each day!
Positivo;Mmmmmmmm love naughty wives smile
Positivo;You deserve a vacation happy
Positivo;Never known how hard it is until last to  days how to resist temptation to enter politics debates on social media happy  stood firm so far
Positivo;Some summer salad inspiration for the BBQ smile
Positivo;Hey thanks for being top new followers this week! Much appreciated happy  Want this ?
Positivo;you should post this offer on this website happy
Positivo;thanks for being top new followers - have a great week happy
Positivo;I prefer it to sharm - enjoy it happy  Gouna 20km away is also quite nice - honestly anywhere away from crazy cairo is
Positivo;Sixth spot not applicable Team! Higher pa! :)KISSES TheFashionIcon
Positivo;Hey thanks for being top new followers this week! Much appreciated happy
Positivo;thanks for the recent follow. Much appreciated happy
Positivo;Thanks Lala.. Much needed happy
Positivo;Thanks for connecting We are passionate about  - hope you like our tweets happy
Positivo;hey, keep smiling happy
Positivo;Said it yesterday... happy
Positivo;We love that our bloggers love us so much happy  Thank you for such an amazing review The Perfect Glasses h
Positivo;only way to make sense of those crazy edge cases is the idea of sharing revenue was offensive, rather
Positivo;Gentle reminder on our TP guidelines happy  please read and spread. Thank you. happy KISSES TheFashionIcon
Positivo;keep being you, cheeky :D
Positivo;smile  So true. For someone who was being recognised for her contribution to fashion, she might have dressed a bit better.
Positivo;sounds like a lot of fun :D I like it
Positivo;Oh, Jin was spotted at Everland today. Nice to see them having a break after the US tour happy
Positivo;There was nothing religious in it. is calling out sexism. I don't think I need to spell out my stand
Positivo;Go back to school for music! I think I will in time happy
Positivo;Theres only one thing I want to change about you . Your Last Name happy  ALDUBOnly
Positivo;welcome brother  happy
Positivo;Thanks for the recent follow Happy to connect happy  have a great Thursday.
Positivo;SONE who cant stream at Genie!You CAN stream for TY at Genie! We are still sharing some Genie IDs. If you want it, DM us happy  S
Positivo;Spending time with dogs or other animals is great at helping you to relax and de-stress. Great idea happy
Positivo;My new video for happy  I hope you like ithappy
Positivo;Got This interview poppin happy  $$$$$
Positivo;Love your tweetability! We'd like to reach out to with an opportunity! Could you hit us with your email happy
Positivo;Thanks for the recent follow Happy to connect happy  have a great Thursday.
Positivo;uss, I'll DM you half naked pictures happy
Positivo;Evet happy
Positivo;Well, I hope it doesn't last too long and you at least get to enjoy the weekend. And happy birthday again happy
Positivo;Excited about event next week in Bangalore!  come happy
Positivo;Want to win a pet chick happy  Simply follow  retweet for your chance to win! Winners will be selected Sunday 23rd. Go
Positivo;Top retweeters this week, Thank you happy
Positivo;dope!! that's a cool word. finally down with the hip young millenial memers smile
Positivo;2nd Cousin Vlad !!!!! maybe thats a message from the Hockey G
Positivo;Thanks for the recent follow Happy to connect happy  have a great Thursday. (Want this?
Positivo;Earlier happy
Positivo;Just win at weekend and it will be a late gift, ok? :D
Positivo;we finally got jinyoung to wipe it for jaebum himself but their precious son blocks it for the world to witness it
Positivo;Here is question 18! Make sure to use in all your tweets  replies happy
Positivo;And this credit also goes to Ik happy
Positivo;My other accounts:them both or get rekt! :D
Positivo;Hey thanks for being top new followers this week! Much appreciated happy
Positivo;Les videre happy
Positivo;clauditte
Positivo;my friend is such an egg
Positivo;congratulations David! Well done Mrs V! Welcome Jessica! happy
Positivo;have you tried these new hacks?! **TRYING DUMB LIFE HACKS 17**
Positivo;Keep tweeting team. Higher! Thank you for the efforts. :)KISSES TheFashionIcon
Positivo;here are some very happy boys to brighten up your day happy
Positivo;A huge thank you to all the within the Social Work  Care Sectors! Keep up the great work happy
Positivo;Lunchtime with Flinthook! This game has so much personality :D
Positivo;Ministers of PMLN are happy like those students who never studied for exams  luckily exams got delayed. They'll still ha
Positivo;:D When mom is a bit tired
Positivo;What we did after the climax shot happy
Positivo;Miss Petite happy Thursday happy   looking forward to the weekend?
Positivo;rt  quote with your name for a calligraphy of it happy  i'll try my best to make it pretty!! non mutuals/mutuals (ifb) fl
Positivo;mutual: let's talk more!me: for sure!mutual:  happy  me:
Positivo;I got TH will add sim ant as a possible thanks happy
Positivo;If you want a friend in Washington, get a dog. :D
Positivo;Congrats Winner :D and it's Eyounji you did well my girl
Positivo;Did you notice? There is no killings of RSS / BJP workers in another Southern State? CM is dismantling Xtian infra in Munnar?
Positivo;Hi please rt my pinned post happy
Positivo;The video will definitely be a 30 minute episode if not longer.
Positivo;I would love to win these gorgeous nail polishes :D! Aren't they cute
Positivo;Jae celebrating with Sheena Easton after the triumphant opening night of 42nd Street in the West End! happy
Positivo;Happy belated birthday :)Another duet of you and Amaal is much needed
Positivo;Your titties are fantastic. Kissy Kissy
Positivo;Pls RT[NCT FIC] Love Song
Positivo;Goodevening happy
Positivo;Ministers of PMLN are happy like those students who never studied for exams  luckily exams got delayed. They'll still ha
Positivo;Thanks for the retweets this week. Much appreciated happy   Want this
Positivo;Erro:509
Positivo;Thanks again for notifying us! We have updated our add-on plans accordingly happy
Positivo;Very cool! happy  surrounds you for a full recovery.
Positivo;A nice morning working from today. Lovely atmosphere, friendly service, wifi, comforting London fog.
Positivo;I just did happy
Positivo;Have a great day everyone happy
Positivo;Kiera's Quest: Awakenings (Kiera's Quest  Book 1)
Positivo;Have you voted for The Wolf's Bite on Greenlight yet? happy  help us get Wolfie  Pigs on Steam!
Positivo;Go back to school for music! I think I will in time happy
Positivo;Here is a new thesis by another genius.Sir, we loved to have reply by you. :D Now get lost .
Positivo;your birthday isn't for another for hours for me, but happy birthday hoe! have a good day, i love you i guess happy
Positivo;Its hard to see your best friend with another girl happy
Positivo;The offer still going happy
Positivo;If you can't be there for someone at their worst then you don't deserve to be there at their best :)KISSES TheFashionIcon
Positivo;Demit the gocoh game is real crying with joy
Positivo;Found use for the sewable LED holder happy
Positivo;Select from 14 award-winning Laura Taylor romance ebooks
Positivo;So excited for the things coming in the future happy  things are going great
Positivo;you guys are entertaining and insightful... and one of the reasons i have been really enjoying LPL a lot more this season :D
Positivo;Thats how it sounds like at superbooth happy
Positivo;i want to learn the choreo but my ugly body says no crying with joy
Positivo;Share the love you're top engaged community members this week! Much Appreciated happy
Positivo;Hi Kylie, looking forward to you visiting! You've picked a great day too, the sun is shining happy
Positivo;Ok. Just please read the replies on this....
Positivo;THIS RIGHT HERE.aren't you happy you don't have [x]???NO. BECAUSE I'M STILL HERE IN THIS 'CONDITION' WITH NO I
Positivo;To all FLA members and officers who are going to Cebu tomorrow silence  Godbless piss off mga ante and angkol!  happy
Positivo;for every like ill post an answer smile
Positivo;Maybe not a band but we can definitely collab! Hi my name is Philip  happy
Positivo;LEGO_Group: LegoThursdays JokerSquad_SWG LEGOLANDWindsor Sounds like you had lots of fun! happy
Positivo;a friend who would like a BRAND NEW Strapback hats only 14.99 at
Positivo;yes you had smile
Positivo;mata_tytan: almightyTANNER: good evening everyone happy  join our twitter party tonight. official tagline:TANN
Positivo;First attempts of bird photography. :-)Passer domesticus. How surprising. wink
Positivo;People who don%27t know me always think I am quiet. People who do know me. wish I was :)KISSES TheFashionIcon
Positivo;Love you too P!
Positivo;RT: good evening everyone happy  join our twitter party tonight. official tagline:TANNER WelcomeBackPH TMI
Positivo;oh yes happy
Positivo;Hey Robert Rolih thanks for the follow! What does coastal living mean to you? Reply with photo :D
Positivo;Have you ever been to AUSTRALIA! :D Love your vids. Lovo on youtube :D
Positivo;OPENING UP TO YOU LOT!RT LIKES WOULD BE LAAAAAVERLY :D .xxENJOY
Positivo;In other words they never missed articles happy
Positivo;IF THE BELOW TWEET HITS 1000 IS GETTING RIAN HOLDING THE STICKER TOO!!! Click the below tweet  SM
Positivo;Bill Nye Answers Science Questions From Twitter | WIRED
Positivo;How are you doing today? happy
Positivo;We're ready for our next fire lighting session at - we have a few keen early birds here already smile
Positivo;Go Kisses!!...  I know you can do it..
Positivo;If this gets 70rts I will giveaway 5 minecraft accounts and an origin account randomly to people who retw
Positivo;Hi Mr. Yen! Will you be doing any signings in New York some day? Your a great role model happy
Positivo;it's just a cut during one of my kitchen experiments happy
Positivo;Wow i just made a JS compressor that actually checks scoped variables existing. Turns out i have a few issues happy  Linters may be useful happy
Positivo;This week Marilyn pops by and get's down and dirty  happy  Cum see!
Positivo;loool i'm mad avoid me today :D
Positivo;You're welcome Thomas happy  Kim
Positivo; Look at this happy
Positivo;He didn't play for a year, so I'm super impressed he's got his musical mojo back! Thank you so much happy
Positivo;Watch this MayWard Fam!
Positivo;I was thinking the same. Our i know is so cute happy
Positivo;SONE who cant stream at Genie!You CAN stream for TY at Genie! We are still sharing some Genie IDs. If you want it, DM us happy  S
Positivo;Mythbuster/20 happy
Positivo;Aha it's okay  she's going to be on Rough Night happy
Positivo;Company photoshoot with our fabulous photographer happy  Look at this determination (concrete shoes) to get
Positivo;Perfect, this worked out beautifully. If you redesign the import page to suit the whole application would mak
Positivo;Hey, have a great day today happy
Positivo;Come volunteer at The Abbeydale Picture House! Next Wednesday...
Positivo;Should have had Farnell Fursday isn%27t it happy  all meet up at Tax and Pounds happy
Positivo;Here's one of my rolls of 'Poundland' film! (A store that sells all products at 140.) And here's the DX d
Positivo;Thanks for the recent follow Happy to connect happy  have a great Thursday.
Positivo;thanks :D
Positivo;Love them! Can I get some? smile
Positivo;OPENING UP TO YOU LOT!RT LIKES WOULD BE LAAAAAVERLY :D .xxENJOY
Positivo;Spending my night talking to my beloved ???Perfect.I LOVE YOU MAN! happy
Positivo;.Is the winner of the donation giveaway, answer this with yoyour steam trade link and ill send you right away :D
Positivo;for the recent follow. Much appreciated happy  Want this?
Positivo;I think I'm probably beyond repair by the sounds of tea etiquette happy
Positivo;.- layout- btob happy
Positivo;i am if you're still looking for one happy
Positivo;Sydney tomorrow, Byron in 3 weeks, Hobart in 7 weeks. Lots to look forward to happy
Positivo;I hit that, new job starts in to  weeks! :D
Positivo;Why do people on the internet have to be such asses annoyance  Here's some positivity for you. I love your art!!! :D It's so pretty!!
Positivo;The best community gathering coming up! We're full, but here's how you can be a part of this happy
Positivo;mutual: let's talk more!me: for sure!mutual:  happy  me:
Positivo;Happy birthday Megan happy
Positivo;Just wandering around, popping into a store, owner told me about it (as in article) smile
Positivo;Did you see this one? happy  Transitional Piece // Chiffon Dress
Positivo;Sixth spot not applicable Team! Higher pa! :)KISSES TheFashionIcon
Positivo;Thank you crew happy
Positivo;a little video i made for the love of my life,, minute yoongi~watch 'til the end for a free cookie happy
Positivo;Just let is know when you'd like one happy
Positivo;you know what i really love about you lot?not only do you support me in the comments, you also support each other! AN
Positivo;I just did happy
Positivo;hey, keep smiling happy
Positivo;Nothing could be better happy
Positivo;so inspiring crying with joy
Positivo;instant message fine yoo, thank you happy
Positivo;What a day! What better way to spend this sunny day than drinks by the shore happy
Positivo;I suppose they are waiting for you happy
Positivo;Aww hating that I got sponsored, how childish of you Commando happy
Positivo;Definitely wasn't what I was looking for :/ But gave it a try anyway happy
Positivo;The one with backward cap, please! :D| KenBie
Positivo;blessing your first day of April happy
Positivo;Helloo :D  (keep_smiling_y)
Positivo;my contribution to ( posted on my tumblr a while ago crying with joy  )
Positivo;Happy Birthday in Chopin style - Piano Improvisation
Positivo;Yes, the problem is only affecting webmail itself. Accessing email from other applications works fine happy  ^mkl
Positivo;He's the best happy
Positivo;where are you now? happy
Positivo;Enter to win 1 of to  boxes of highly anticipated books! 6 books in each box! Open INT happy
Positivo;Congratulation my world happy
Positivo;Helloo :D Mr Drippy (CallMeErgan)
Positivo;good crying with joy  i love you so much
Positivo;Wow awesome GOG! thanks happy
Positivo;Does anybody out there need any motion design or animation help?  If so I am available happy
Positivo;YES!!! Neil Gaiman for life! :D
Positivo;As the last event for chapter 1, we've invited 24 people to propose visions of the future. Jom happy
Positivo;Exaseetly what's happening in TN Politisees. This is not to get BJP at all to TN. Game is different. Again, you'll be see
Positivo;i don%27t know doesnt seem fair to me..two against one happy
Positivo;Helloo :D Braids! (keyrazygirl15)
Positivo;Thank you mama bear! Ang ganda mo happy
Positivo;Okay, now I'm really out. happy
Positivo;Helloo :D Kesh (MzKeshNJ)
Positivo;As in most used. Stats don't care about motivation happy
Positivo;kind of jealous with you all laughs but it's ny fault for not working hard happy
Positivo;Appreciate your recent retweets Have a great Thursday happy
Positivo;SHOULD I STAY ? SHOULD I GO ? NOBODY KNOWS happy
Positivo;Helloo :D Mack. (Macktimus)
Positivo;LADIES!  - tell me why yoyoyou don't play golf. What wyoyoyoud make yoyoyou want to play? Top 3 reasons yoyoyou DO play? heyjyoyoyoude66info
Positivo;Thanks for the this week, much appreciated happy
Positivo;Nearly done now! Thanks everyone for joining and hope to see you same time next Thursday happy
Positivo;Oh that feel when you have 10 gems :D
Positivo;Helloo :D chammy (shamirakay)
Positivo;Good luck to Rich riding for great project in this Sunday. Can you donate?
Positivo;You too my friend. smile
Positivo;RT: almightyTANNER: good evening everyone happy  join our twitter party tonight. official tagline:TANNER WelcomeB
Positivo;Amazing stuff!!! Thansk for this happy  Birth Control - Gamma Ray (1972)
Positivo;Noted on this Sir, The bus from Bangsar heading to Awan Besar. Have a Good Day happy
Positivo;Thanks for the recent follow Happy to connect happy  have a great Thursday. Want this
Positivo;Helloo :D Best damn avocado (Batsyy_)
Positivo;lets agree she put her brain on knees crying with joy
Positivo;Wish you were here smile
Positivo;Everyone from getting punched :D
Positivo;i welcome you to germany then. i have no authority to welcome you in the other countries though! happy
Positivo;better be oldschool crying with joy  RS3 equals  aids 3
Positivo;Nothing could be better happy
Positivo;PLEASE THIS BEAUTIFUL PRINCESS HAVE YOUR HELP, Give a little for her happy
Positivo;always running out of space on my phone, thank you kpop crying with joy
Positivo;One by one Allah ease my problem . Lot of thanks to Him crying with joy
Positivo;thank you for sharing happy
Positivo;Nothing could be better happy
Positivo;Hopefully it should be OK happy  Charts don't look too bad at moment but depends on tides  directions, Keep
Positivo;soon :' I need you so much crying with joy  {} I need you kaswa :'
Positivo;Only laksa can make me okaay now crying with joy  I need laksa
Positivo;Helloo :D car fox  (ror925)
Positivo;Thanks for connecting We are passionate about  - hope you like our tweets happy
Positivo;mutual: let's talk more!me: for sure!mutual:  happy  me:
Positivo;Who wants some good vibes? Watch this on YouTube or TV100 application now for FREE happy
Positivo;Tara, Hi, all! I'm Roy Dahildahil, co-founder of and I'll be moderating tonights tweetchat. happy
Positivo;SONE who cant stream at Genie!You CAN stream for TY at Genie! We are still sharing some Genie IDs. If you want it, DM us happy  S
Positivo;Enjoy happy
Positivo;Happy Thursday loves!! happy
Positivo;Good Morning Peady, you need a direct coffee feed to Starbucks happy
Positivo;You better check this out
Positivo;Thanks for the recent follow Happy to connect happy  have a great Thursday. Want this
Positivo;Ummm announced a new show in Buffalo! He should ask to be an opener! happy
Positivo;The world is so big. Too big for our problems and worries to take over our world. There is much to smile for happy
Positivo;Friday after the conference some of us will go for dinner to favourite smile
Positivo;Follow  to a Saga diary and a year's worth of Saga pens :)TCs
Positivo;Im done trying to take men seriously happy
Positivo;for being top High Value Members this week happy
Positivo;okay happy
Positivo;little fans. - happy
Positivo;Here's the full art for both Glyph Keeper and his mummy token. For those interested they will be hitting ebay tonig
Positivo;Seokjinie went to Everland today~ I guess he forgot that he's an idol, which is good for him happy
Positivo;Welcome happy
Positivo;i wasn't saying i read a book today, i was telling you to read a book today. knowledge is power. knowledge is growth. kee
Positivo;in game you move him to camera happy
Positivo;Veronice and Jughead! happy
Positivo;oh my god it's raining where i live too crying with joy  AND STOP OMG I WANNA CUDDLE HIM NOW
Positivo;Hehe take care Andy friend happy
Positivo;vocal coach IG post:
Positivo;Hold off the frowns until you've used the new application - which is made by the same team! happy
Positivo;I love it when Ben sleeps in because I get to watch all the programmes I want on Netflix without interruption !!!! happy
Positivo;Thanks happy
Positivo;Nothing could be better happy
Positivo;Thank you crew happy
Positivo;Someone asked me Hows life? I just smiled and replied, Shes fine :)KISSES TheFashionIcon
Positivo;Yeaaaah! Alpha Invitation well received happy
Positivo;Good luck Swampy happy
Positivo;What to do when you are feeling bad - buy a new book and get engrossed into a new world happy
Positivo;in may go away happy
Positivo;April is really really bloody. I'm so proud of our boys crying with joy
Positivo;Have you smiled today? Never forget to smile happy
Positivo;Then and now happy
Positivo;Gott happy
Positivo;Nothing could be better happy
Positivo;There you guys. Read it for once at least. crying with joy
Positivo;I hope Louis gets all the off time that he wants and comes back fresh and happy happy
Positivo;Yes we can do that! happy
Positivo;Famfrit with and people happy
Positivo;But, er, sloths are great? So it's a good un-unthinkable picture? Have I dug mysel
Positivo;Thanks much appreciated happy  The magic of
Positivo;On our way home happy  happy si Noah sa skyranch
Positivo;Thanks for the recent follow Happy to connect happy  have a great Thursday. Want this
Positivo;This is why I made the video about improving your line work on YouTube, when you have to do things like this happy
Positivo;Client work for rt and favorite happy
Positivo;Everything is a choice happy
Positivo;Awesome! makes a good nurse maid, huh? happy
Positivo;Thanks for the recent follow Happy to connect happy  have a great Thursday.
Positivo;Thanks for being top engaged community members this week happy  - Try this too
Positivo;Thanks for the recent follow Happy to connect happy  have a great Thursday.
Positivo;Funny happy
Positivo;1st day of JA Entertainment's Marathi Film Savita Damodar Paranjpe Have been a big fan of this story. Finally get
Positivo;Its been a good day hey. happy
Positivo;mutual: let's talk more!me: for sure!mutual:  happy  me:
Positivo;Surround yourself with positivity happy
Positivo;Still live!
Positivo;And GST is the brain child of our Modiji happy  Perfect!
Positivo;She also makes some of the most beautiful art (my biggest inspo) All for sale if anyone is interested happy
Positivo;Thanks for the recent follow Happy to connect happy  have a great Thursday. Want this
Positivo;Thanks for up-voting us on PH happy
Positivo;good, that might have cost you $3 a month!!!!   happy
Positivo;Great to see you buddy nicest dude in the world. Keep killing it brother happy
Positivo;i have bronchitis i love that happy
Positivo;Thanks for the recent follow Happy to connect happy  have a great Thursday.  Want this
Positivo;20% off all Knight  Day Jewellery ends this Sunday-Why not pick up something nice for
Positivo;The Bank Job, coming soon to a screen near you.
Positivo;157 days to go happy
Positivo;going to go meet andrew for lunch now but i'll be back at to  or to :30, i'm upstairs to the right happy
Positivo;We're you also at our signing session with Qian Liu  Jared Wright after the last performance of Onegin? Share your
Positivo;Happy birthday, Bram Stoker. Can't wait to show you in bronze soon. happy
Positivo;Not in the tweet I ve meant the article itself happy
Positivo;i send people bunny pics, let me know if you're up for that happy
Positivo;Thanks for being top engaged community members this week happy  (Want this ?
Positivo;If you're an aspiring developer in or near Krakw this is an excellent opportunity. They even pay their interns happy
Positivo;Thankfully I didn't have to chop it myself, arrived on the back of a little tipper lorry smile
Positivo;Prepare to be inspired! happy
Positivo;Ready Now! One 9 week old chocolate female puppy from Harlowe x Sterling! happy  This girl is a sweetheart and has a...
Positivo;Again as I said I do see your concerns. But I assure you sir that Hinduism will stay Dharma and will no
Positivo;This is just super Can't wait happy
Positivo;Notice anything unusual? Happy birthday to the lovely Frooty! happy
Positivo;Rose come to him! He's really your enthusiast :-D using SO MUCH not SO MAY!  :-)~~~
Positivo;Thanks for the follow happy  If we can help your business in anyway please get in touch
Positivo;Thanks for the recent follow Happy to connect happy  have a great Thursday.
Positivo;.a scan for your tumblr happy
Positivo;New Upcoming Heroes REVEALED! WUKONG, DRAGON  MORE! OMG :D
Positivo;This never happened with our happy
Positivo;Awesome recommendation Jess! Listened to the
Positivo;thanks b happy
Positivo;Congratulations, you've got the message happy
Positivo;That's kaki no tane and it's amazing! Foyound a place here in Germany where you can import it! :D
Positivo;No breaks and a first practice exam happy
Positivo;made dinner for two tonight happy
Positivo;Share the love you're top engaged community members this week! Much Appreciated happy
Positivo;You know exactly what I'm talking about happy
Positivo;Thanks for the recent follow Happy to connect happy  have a great Thursday.  Want this ?
