opiniao;tweet
Positivo;Remember- vocab knowledge is worth 75% of your grade! Will announce winner tomorrow morning at 10am! happy  15 to purchase! happy
Positivo;good luck! You have my vote smile
Positivo;19 days of school left happy
Positivo;Will you do before and after pictures? I always enjoy your swanky hair happy
Positivo;"In class and I'm really bored so why not happy  Rt for one!! Mutuals  non mutuals Pls don't let me flop ;-;"
Positivo;GIVING AWAY ALL THESE SOUVENIRS TO 5 LUCKY WINNERS!To Enter: Follow + RTRolling winners in 48 hold on
Positivo;Watch your words happy
Positivo;Thanks for the recent follow Happy to connect happy  have a great Thursday.  Want this ?
Positivo;Nice gif happy
Positivo;Share the love:thanks for being top new followers this week happy   Want this
Positivo;But I think you'll do better than me happy
Positivo;Indeed, and I suspect you will be one of the few who would get it happy
Positivo;One of our fleet is solely seeharged by domestisee hydro  Toro see
Positivo;for trade ? happy  what yeah want ?
Positivo;Get this to 150!!
Positivo;New twitter acc. happy
Positivo;Share the love - High Value Members of this week happy  (insight by
Positivo;Soon I'll make arts happy
Positivo;That would be a great trick happy
Positivo;Thanks for the recent follow Happy to connect happy  have a great Thursday.
Positivo;.NOTHING CHANGED BUT THE DATE .. APRIL 28 MAKE S
Positivo;Delma Hanville It's official we are connected on Twitter! Thank you for the follow. Please don't ever Let It Go! happy
Positivo;13 Reasons Why producers: we care about youth mental health :)13RW producers: *show young audience graphic rape and suicide s
Positivo;fun and funny.... this book will warn up your kindle at night happy
Positivo;And that's what's important! happy  that's what I'm trying to remember.
Positivo;Congrats for 3M followers on Instagram! happy
Positivo;Gourmet chocolates are special and should be reserved for special occasions. Plain MMs, not being spe
Positivo;Sixth spot not applicable Team! Higher pa! :)KISSES TheFashionIcon
Positivo;Can you guys make the Japanese Greninja's and Waveguider come as well? happy
Positivo;Thanks for the recent follow Happy to connect happy  have a great Thursday.
Positivo;thanks for the recent follow, much appreciated happy   Want this
Positivo;Sister cyril came to our school once happy
Positivo;Join us this Saturday to celebrate our Earth by planting seedings! Head to our FB page for more information. happy
Positivo;we finally got jinyoung to wipe it for jaebum himself but their precious son blocks it for the world to witness it
Positivo;i love him crying with joy
Positivo;kind of like my layout happy
Positivo;New twitter account piss off no idea MAJA SALVADOR is Follow not applicable guys happy
Positivo;thanks for the recent follow, much appreciated happy  (Want this for It's Magical!
Positivo;Congratulations very impressive happy
Positivo;Client work for rt and favorite happy
Positivo;Thanks for the recent follow Happy to connect happy  have a great Thursday.  Want this
Positivo;Did you go all the way to Keem? Have you been up Minaun? That's a good one if you are into extreme driving today smile
Positivo;I really must go see Power Rangers again. smile
Positivo;Maybe I do, maybe I don't, who knows :D
Positivo;Broadcaster says Fly Away reminds him of early happy
Positivo;Great night! Hope you enjoyed the strip club after happy  Thx for photo
Positivo;Right I seriously need a decent Butterfly Tattoo design, if anyone has got a design or could find me one I would be so grateful to you :D
Positivo;thanks for the recent follow. Much appreciated happy   Want this ?
Positivo;Thanks for the recent follow Happy to connect happy  have a great Thursday.
Positivo;Good evening happy
Positivo;i always knew you woyould like this one better :D hahaha.
Positivo;Sure do! happy
Positivo; yes it would have if it hadn't been for those meddling clouds smile
Positivo;Gamer Follow Train!Follow MeRetweet thisFollow all who retweetedGain active followers happy  450
Positivo;Thanks for sharing my iris photo. I really appreciate it smile
Positivo;rt for 13 ffs-it's not much but they're free-legit-free but follow me first to get them quicker-be patient i will g
Positivo;Myth is a good Team, but Genix deserves so much more than Myth! Open your Eyes The Community want
Positivo;Hellooo.. happy  satans-daughter (taylynnox)
Positivo;mutual: let's talk more!me: for sure!mutual:  happy  me:
Positivo;Hellooo.. happy  Lil strait (Daddyy_rat)
Positivo;Are you also attractive to Liza Soberano? happy
Positivo;Pfft- crying with joy  Oh.. I hope year oldu're okay, papa bird? I hope year oldu don't mind? Because I want to stay with year old
Positivo;Hellooo.. happy  Kyle Davies (RebelByACause)
Positivo;opera Nirjhor As long as they are not claiming to be the first one :D /Rosi
Positivo;will miss it but I'm on an open education seminar in Palestine happy
Positivo;Stats for the day have arrived. 1 new follower and NO unfollowers happy  via
Positivo;Wow! My friend Dara shared this from her hubby!!! He looks TERRIFIC. :)Order YOURS here -
Positivo;Annapurna studios production no.29 on floors tomorrow. In this heat we are going to turn on the heat happy  can't expre
Positivo;will there be a new amazingphil video today? happy
Positivo;Veronice and Jughead! happy
Positivo;Cpl Swallows just gone over the house. Heard them whilst flying my drone.. happy
Positivo;Who wants some good vibes? Watch this on YouTube or TV100 application now for FREE happy
Positivo;We've 80 so far in our collection of 150+! happy  New gin menu coming soon as well!
Positivo;That would be a great trick happy
Positivo;i don%27t know he looks so cool crying with joy
Positivo;Hellooo.. happy  pussy (creepz_x)
Positivo;on Snapchat happy
Positivo;enjoy smile  h.e.r.
Positivo;rt if you hate me crying with joy
Positivo;Die evil raven! :D
Positivo;Never give up on the things that make you smile happy
Positivo;Stats for the day have arrived. 1 new follower and NO unfollowers happy  via
Positivo;Haha thanks fansnim! happy
Positivo;"i took a full drink into my uber; i guess you could say instant message pretty wild. These are the Tuesdays we'll never forget happy"
Positivo;It's a very cute picture though :D
Positivo;Play your part in raising funds for :
Positivo;Ohh yeah and we had sausage with our pancakes happy  x
Positivo;especially for people who have low patience level happy
Positivo;online shopping timmeee. anyone got good site suggestions? happy
Positivo;Not really I am a Labour supporter and am actually quite glad happy  I mean how much did he claim in 2009 fuck off
Positivo;Issa Throwback. happy
Positivo;Ouuuuu..... right in the jewels! :D
Positivo;your an inspiration to everyone Miss Jones happy
Positivo;Feeling myself, got on my favorite boot cut jeans and roshe runs. No girl is safe today. Have a blessed 4/20 all smile
Positivo;Uncheck new arrivals happy
Positivo;AVI for my man :)Phone made like always wink
Positivo;Hellooo happy  Ross Chaplin  (MasonCooper4)
Positivo;I write fiction. Some PR knob who writes sentence fragments on an iPad next to the Shoreditch House piss off
Positivo;Love this!
Positivo;instant message perfectly fine :D how about you fellow ken
Positivo;the displayport to HDMI turned up so we back on to  screens o/ 5 days to get the dual PC stream setup sorted (lol) :D
Positivo;pips singing let it snow crying with joy
Positivo;Let me eat that cake! :D :P
Positivo;Nah  over-rated happy  x
Positivo;You may draw your conclusions from any deviation from that level either in the direction of therapy or prevention
Positivo;Does not matter, as long as she's cool, I'll like her happy
Positivo;Teaser coming out today at 4pm!Story, music and direction by of my favourites by
Positivo;Hey everyone me and Harry have just had pancakes and maple syrup for breakfast . Great way to start the day happy  Miss you a
Positivo;Cheers :D
Positivo;thanks for the recent follow. Much appreciated happy  Want this
Positivo;Thanks for sharing my iris photo. I really appreciate it smile
Positivo;Hey thanks for being top High Value Members of last week, have a great
Positivo;I'm sorry but people have to  make a living happy
Positivo;I check Beautiful News every single day, It really is uplifting and inspiring, plus I want to win that Merc C63 silence  Sooo! happy
Positivo;please let me meet taehyung hiks crying with joy  really hope i could win.This is my first cover
Positivo;year old i am commenting on all the new ladylike videos. trust me. not a troll, just me killin time to say hey! :D
Positivo;celebrate Hitler's birthday! =D
Positivo;Just delivered my Managing the Online Customer Journey keynote at the Autodesk Partner Event. Incredible event
Positivo;There're time we shcj do/did something that dissapointed ot6,there're time shinhwa do/did something,well..human. That's all i
Positivo;new video out today happy
Positivo;Merry Christmas everyone happy
Positivo;big love for Anne cox happy
Positivo;Just a new happy
Positivo;Hellooo happy  Jackatkinson (jackat13)
Positivo;thanks for the recent follow. Much appreciated happy  Get it
Positivo;thanks for the recent follow, much appreciated happy   Want this
Positivo;Thanks for having me!! :D
Positivo;Hellooo happy  Xbox adHatter (XboxMadHatter)
Positivo;is the RockSoc still going? I was there at the beginning smile
Positivo;wow whattay decision both parties celebrating :D
Positivo;Free market is tops!!! Real human rights sound great to me, thanks for your articles. B
Positivo;Hahaa I'm second best always happy
Positivo;Hellooo happy  KT Bear (FFABear)
Positivo;Superstar thanks so much for the kind words! Look forward to seeing you soon buddy smile
Positivo;yes... kind of funny and creepy at the same time  happy
Positivo;Ministers of PMLN are happy like those students who never studied for exams  luckily exams got delayed. They'll still ha
Positivo;If you can send me a DM with your postcode I can check a few of your local stores. Look forward to your reply happy  - Nathan 2/2
Positivo;Petronas blue/green isnt that far away from Billy Monger blue/green.  Just a thought happy
Positivo;I have tested all sweet dishes but they are not as sweet as my lovers lips :)MARVOREE MagpasikatOnShowtime
Positivo;Ma de tonight i don%27t really care crying with joy
Positivo;Had a fun welcome back to taping! first day for happy  Mainit. Pawisan. Dirty. I really miss this
Positivo;Oh you American cultists :D
Positivo;Hi Stefan :)I am pretty confident this is isolated case and I would be glad to help with it.Could you DM me
Positivo;Hellooo happy  PixelSavage (Pixel_Savage_Yo)
Positivo;I feel that way about life and is what gets me through everyday in a positive mood! happy
Positivo;Your life is a reflection of the way you think. If you change the way you think, you change your whole life happy
Positivo;More kid/parent friendly spaces like this please.
Positivo;That would be a great trick happy
Positivo;Va astept la acest eveniment! :)Next events:
Positivo;Thanks for the recent follow Happy to connect happy  have a great Thursday.
Positivo;.listen to this beautiful video of her si
Positivo;mutual: let's talk more!me: for sure!mutual:  happy  me:
Positivo;happy birthday crying with joy  yoyour so so cool and i hope yoyour day goes super good
Positivo;Hellooo happy  CJAY (CJAY_100)
Positivo;Thats sooooooooooooo sick!!!! xD Thanks so much for making it Kin!! I love it! :D
Positivo;That would be a great trick happy
Positivo;I think I've finally figured out the tattoo I'm getting in August :D
Positivo;So excited for ball to start smile    my baby is in minor B and I absolutely love watching them play
Positivo;Playing with the photo editor happy
Positivo;Thank you! happy
Positivo;Hellooo happy  Bluey (xBlueys)
Positivo;I love you so much Rui-chan smile  smile
Positivo;Hellooo happy  Xbox adHatter (XboxMadHatter)
Positivo;Mine isn't.  They back Jeremy 100% I'm pleased to say happy
Positivo;I dedicate this song to
Positivo;Thanks brother ,stay cool ,keep loving Deepika ,ban ja hero :D
Positivo;Made new logotypes for Really fun to work on  You should follow if you want to keep yourself updated
Positivo;Shut up, you don't ever have to thank me J hunt, I'll always be there. Love you happy
Positivo;Dispo 3LANs happy
Positivo;laughing out loud so cuteee happy
Positivo;Thanks for the recent follow Happy to connect happy  have a great Thursday.  Want this ?
Positivo;Thanks for the recent follow Happy to connect happy  have a great Thursday.
Positivo;That would be a great trick happy
Positivo;Sir Ash Ketchum and Princess May. happy
Positivo;this guy got me into exo back in 2013. he was also my very first bias in kpop. to be honest i miss him so much. happy birthd
Positivo;Thanks for the recent follow Happy to connect happy  have a great Thursday.
Positivo;Hi Yolandi, thanks so much for following us! We'd love to know what you think of our flooring range happy
Positivo;That's the law of nature happy
Positivo;thanks happy
Positivo;Get your Own Rover :Dthey are Double Sided! check it out shipping: worldwide!
Positivo;Prettier 1.0 is not the end. I just released 1.2.0 that fixes another batch of edge cases happy
Positivo;thanks for the recent follow. Much appreciated happy  Want this?
Positivo;.Thanks so much for the RT, and have yourself a groovy Thursday!  happy
Positivo;your always welcome thank you sa treat sa susunod ako happy
Positivo;These are for  happy
Positivo;Slayin_Bodies Going Live...Please Tune In...Thank You happy
Positivo;Made my day! Great story happy
Positivo;i will do happy
Positivo;Thanks for the recent follow Happy to connect happy  have a great Thursday.
Positivo;Maybe? Definitely! happy  Also, try the front door, it may be open happy
Positivo;thanks for the follow, have a great week!! happy
Positivo;haha! i would love to work for a train company :D be a great dream come true!
Positivo;Dumbing down of popular entertainment is an important issue.
Positivo;Hey thanks for being top new followers this week! Much appreciated happy
Positivo;i swear sometimes it's cool to break some mutuals happy
Positivo;........Yeah sure happy
Positivo;Go to Five Below. You can get a decent protective case that's cute for 5 bucks happy  it's where I got mi
Positivo;Hey thanks for being top new followers this week! Much appreciated happy   Want this ?
Positivo;Thanks for being High Value Member  this week, Much appreciated happy
Positivo;I love laying in a meadow of flowers listening to Mellow's music ...a great way to relax smile
Positivo;not going to burst more data crying with joy
Positivo;Thanks for the recent follow Happy to connect happy  have a great Thursday. Want this
Positivo;thanks for the recent follow. Much appreciated happy   Want this ?
Positivo;I say keep with it. happy
Positivo;In case you missed it, I released a new video about game genres.RTs are super appreciated happy
Positivo;Thanks for the recent follow Happy to connect happy  have a great Thursday.
Positivo;Dude, this freaking chapter of One Piece!! It's definitely a good one! :D
Positivo;Who wants some good vibes? Watch this on YouTube or TV100 application now for FREE happy
Positivo;No worries happy
Positivo;Nitpicking, I know. happy
Positivo;and the hype is real happy
Positivo;FL design Done by me  Inspired from FL  Hopyou you all love it
Positivo;Bambam talks the most tonight :D
Positivo;my favorite hobby is finding the negative in a positive thing happy
Positivo;Hey thanks for being top new followers this week! Much appreciated happy   Want this ?
Positivo;Ah, sorry about that. You can always ask us to follow you so you can DM you happy
Positivo;after that I was charged because of the driver happy  after waiting in the sun for 10 minutes! TEN!
Positivo;to WIN draw for free download of for Celebrate with us. Developed by for
Positivo;true
Positivo;They pinched him on a free? His quality on FM smile
Positivo;CSGOBOUNTY GIVEAWAY - 1 random KEY. 25 RETWEETS, random winner :D Retweet AND LIKE to be able to win happy
Positivo;Thanks for the recent follow Happy to connect happy  have a great Wednesday.
Positivo;You are welcome happy
Positivo;This makes a great point, I really liked  happy
Positivo;Superstar thanks so much for the kind words! Look forward to seeing you soon buddy smile
Positivo;Can you do that when player kills you. Then the player rank would show up. happy
Positivo;True! U can waste a day in social media and reading websites. On the other hand, idea of saying No to almo
Positivo;i love him so much i want to kindly stroke his penis :D
Positivo;Thanks, i'll give it a try happy
Positivo;I would say quite a lot...but hey, that's Europe, rather than the UK, isn't it? smile  Britain co
Positivo;YO THANK YOU FOR OVER 15,515 SUBSCRIBERS!!!! :DTHE CONTINUES!
Positivo;Thanks for the recent follow Happy to connect happy  have a great Thursday. Want it
Positivo;Last retweet about happy
Positivo;Hello everyone, have a great Thursday! Looking forward to reading your tweets happy   Want this
Positivo;apr. 26th beach house! dinner+music+ party with oldies goldies happy  buffet / BBQ 40TLbeer-  wein10TL raki12.5TL h
Positivo;We've been selected among the top 20 Social Media blogs, woot! smile
Positivo;Thanks for the recent follow Happy to connect happy  have a great Thursday.
Positivo;I wanted $25 million and they were only offering 24. smile
Positivo;Give away Random RT! for a chance to win a 10USD iTunes or GP gift card! Winner will be selected in a few minutes happy
Positivo;Share the love: thanks for being top new followers this week happy  Get it
Positivo;Thanks for the recent follow Happy to connect happy  have a great Thursday.  Get FREE?
Positivo;Thanks for the recent follow Happy to connect happy  have a great Thursday.  Want this
Positivo;Thanks for being top engaged community members this week happy  (Want this? It's FREE!
Positivo;What a beauty he scored the other night!! Hope we get him too happy
Positivo;And you were there happy
Positivo;haha! Very good tweet mate happy  heard your a big boy account! The King shit happensould we say happy  any chance of a shit happens
Positivo;Thanks for the recent follow Happy to connect happy  have a great Thursday. Want this?
Positivo;I appreciate the sentiment but I couldn't do that. happy
Positivo;Younger. Softer. crying with joy
Positivo;Happy many days, months and years of bonding and happiness  family MCLISSE StarMu
Positivo;Thanks for the recent follow Happy to connect happy  have a great Thursday.
Positivo;I'm happy   happy
Positivo;Yes! With subtitles only happy
Positivo;Thanks for the recent follow Happy to connect happy  have a great Wednesday. Want this
Positivo;co
Positivo;Thanks for the recent follow Happy to connect happy  have a great Thursday. Get it
Positivo;Thanks for the recent follow Happy to connect happy  have a great Thursday.
Positivo;thank you! happy
Positivo;That would be a great trick happy
Positivo;thanks for the recent follow. Much appreciated happy   Want this ?
Positivo;Thanks for the recent follow Happy to connect happy  have a great Thursday. Want it
Positivo;[bot] i'm not perfect happy
Positivo;Retweet if you are with us? Kaway kaway family :)MCLISSE StarMusicIfWeFallinLove
Positivo;We have a few breweries in the UK too.... smile
Positivo;Thanks for the recent follow Happy to connect happy  have a great Thursday. Want this?
Positivo;Thanks for the recent follow Happy to connect happy  have a great Thursday.
Positivo;I've had it since December  my hairs stopped snapping off! It's made a massive difference! Get the
Positivo;Be happy, love happy
Positivo;That would be a great trick happy
Positivo;Do It Like It's Legal sweaters  ..More designs available at
Positivo;Great groove to this tune by and .. Thinking in Rewind
Positivo;Mrs King is excited to work with students today! Check out this cool classroom shape! Lots of math in here happy
Positivo;$ES_F $SPY  Bulls are just relentless  happy   Some setups I like today
Positivo;Thanks for the recent follow Happy to connect happy  have a great Thursday.
Positivo;Thanks for the recent follow Happy to connect happy  have a great Thursday.  Want this
Positivo;Thanks for the recent follow Happy to connect happy  have a great Thursday. Want this
Positivo;you know that the problem still exist :D
Positivo;Thanks for the recent follow Happy to connect happy  have a great Thursday. Get this
Positivo;- top engaged members this week happy
Positivo;ngam to  weeks left for cadet pilot exam crying with joy
Positivo;Great! You're welcome Josh happy  ^Adam
Positivo;Sixth spot not applicable Team! Higher pa! :)KISSES TheFashionIcon
Neutro;Pak PM survives removal scare, but court orders further probe into corruption charge. 
Neutro;Supreme Court quashes criminal complaint against cricketer for allegedly depicting himself as on magazine cover.
Neutro;Art of Living's fights back over Yamuna floodplain damage, livid. 
Neutro;FCRA slap on NGO for lobbying...But was it doing so as part of govt campaign? 
Neutro;Why doctors, pharma companies are opposing names on 
Neutro;Why a bicycle and not a CM asked. His officer learnt ground reality -- and  a dip in a river. 
Neutro;It's 2017. making law to ban And MHA is sitting on draft. 
Neutro;Rivals govts unite to act against sex-determination tests. 
Neutro;Haryana peasants demand justice for right to cattle trade. 
Neutro;Why schools in Calcutta (and elsewhere) are stunned by imposition plan. 
Neutro;Why renamed places in 
Neutro;Oooh! the shame, the trauma... of driving without the red, flashing light. (And paying for parking). 
Neutro;Now have to learn to live without that flashing red light. 
Neutro;BJP leaders in the dock, lose their light, naming game, and more. Also in epaper. 
Neutro;UK Parliament votes by 522 to 13 in favour of early national 
Neutro;April 19 1906: Nobel Laureate Pierre Curie was run over by a horse-drawn wagon near the Pont Neuf, Paris, and killed 
Neutro;India to end culture of sirens on cars. 
Neutro;From May 1, only on vehicles: Gadkari.
Neutro;No from now on cars of PM, ministers: transport minister Nitin Gadkari after Cabinet meet. 
Neutro;44 feared killed as bus falls into River Tons in Nerwa area of district: police. 
Neutro;BSF dismisses Constable Tej Bahadur Yadav from service after a court of inquiry. Bad quality food allegations were base
Neutro;jawan Tej Bahadur Yadav, who took to social media complaining of bad food, dismissed from service after inquiry.
Neutro;U.S. to review lifting of sanctions on Iran: Tillerson 
Neutro;Huge haul of milk-boosting hormone in Calcutta. 
Neutro;Good news from it seems are thriving at Valmiki reserve. 
Neutro;In Sushil Modi lists property chain. 
Neutro;3 queens take centrestage. 
Neutro;A peek into FIR against leaders in case. 
Neutro;Spurned by mom, this baby at Calcutta has died. 
Neutro;India may make it illegal for social messaging platforms to share personal data. 
Neutro;Why extradition could take ages. 
Neutro;March 20. Plus 15 days. Equals...
Neutro;KP Nayar on why discrediting military justice system will not help case. 
Neutro;Sharad wants Gujarat CM arrested for trying to push making meat a communal issue.  
Neutro;Man shouts at wife in family court. And walks out. 
Neutro;Overburdened says it may not be able to hold for college teachers this year. 
Neutro;President backs move to make mandatory up to Class X. 
Neutro;Nationalist trend spreads-- tightens rules to shield local jobs (and keep out Indians). 
Neutro;Visa 'selfie' by CBSE's plans, blessing, cloud over and more. Also in epaper. 
Neutro;Scotland Yard arrests in London, but court grants him bail. 
Neutro;Liquor baron declared a proclaimed offender, on extradition warrant: Scotland Yard.
Neutro;British Prime Minister Theresa May says she wants to hold early election on June 8: Reuters, quoting BBC 
Neutro;Supreme Court seeks govt's response on a plea to frame national policy to promote and 
Neutro;JK: Schools  colleges shut down after clashes, demands Presidential rule 
Neutro;Beetle from grips litchi crop in 
Neutro;Supreme Court asks govt to explain why need pre-censorship.  
Neutro;"US NSA H.R. to arrive in today; to hold talks with NSA "
Neutro;Why you should shun water at beaches. 
Neutro;Having lost Kerala bypoll, won't have to keep its promise of 'good quality 
Neutro;So, is -- and not to blame for stipend crisis faced by 4000 scholars? 
Neutro;The middleman (or conman) nephew tapped to bribe election commission officials. 
Neutro;Can  Air India enforce fines on unruly passengers for 
Neutro;Top law advisor backs use of human shield, but some veteran generals see breach. 
Neutro;Arrest of a conman and bribe charges against nephew churns politics. 
Neutro;How cloaked debate in Draupadi's robes. 
Neutro;Draupadi and campuses in erupt, politics, and more. Also in epaper. 
Neutro;CBI books 12 leaders in case. 
Neutro;Supreme Court summons boss, orders sale of slice. 
Neutro;SC summons Home Secretaries of West Bengal, UP, Karnataka, Tamil Nadu, Bihar  Jharkhand for nice try filling police vacancie
Neutro;Manini Chatterjee on why writings are still an indictment of India. 
Neutro;Why wants paper trail in elections. 
Neutro;Govt to set up panel to study service conditions of paramilitary forces. 
Neutro;Amit Roy on an potboiler.  
Neutro;Muslim body lays down code of conduct during divorce, but won't ban 
Neutro;Modi's call to ensure justice for women facing evil customs.  
Neutro;PM's pitch for sisters, board's stand on an potboiler. And more. Also in epaper. 
Neutro;Why the always meets this man when he visits eastern India. 
Neutro;Secessionists in and the next generation. 
Neutro;In 7Days: secessionists, tete-a-tete with a former president, a dying language, and more. 
Neutro;Farooq Abdullah wins seat -- with just 4% of total votes. 
Neutro;No govt probe yet into video on by army. 
Neutro;As learns to follow rules, funds for poor students dry up. 
